Name,Title,Keywords,StartPage,EndPage,Pages,Year,NBN
"Brattmyhr, John",125 år på Skansen : historier för liv,Skansen,10.0,27.0,18.0,2016,urn:nbn:se:nordiskamuseet:diva-2118
"Falck, Per (Nordiska museet [877150])",1700-tal i repris : nya fakta om gamla möbler,Möbler;1700-talet,25.0,44.0,20.0,1993,urn:nbn:se:nordiskamuseet:diva-1675
"Ciszuk, Martin",1700-talets sidentyger : analys och inspiration,Sidenvävning;Sverige,180.0,195.0,16.0,2002,urn:nbn:se:nordiskamuseet:diva-1833
"Garnert, Jan (Nordiska museet [877150])",90-talsperspektiv på elektrifiering och trefasteknik,El;Elektrifiering;Trefassystem,85.0,96.0,12.0,1991,urn:nbn:se:nordiskamuseet:diva-1618
"Tin, Mikkel B.",Abstraksjonen i et moderne maleri og et tradisjonelt broderi,Textilier;Folkkonst;Måleri;Broderi,119.0,134.0,16.0,2005,urn:nbn:se:nordiskamuseet:diva-1873
"Wallin, Sigurd (Nordiska museet [877150])",Adelshovets heraldik,Heraldik;Adel,61.0,76.0,16.0,1961,urn:nbn:se:nordiskamuseet:diva-1224
"Fleetwood, George W (Nordiska museet [877150])",Adelsuniformen,Uniformer;Adel,13.0,28.0,16.0,1940,urn:nbn:se:nordiskamuseet:diva-529
"Meyerson, Åke (Nordiska museet [877150])",Adligt nöje : Tornering och ringränning under äldre Vasatid,Torneringar;Adel,137.0,148.0,12.0,1939,urn:nbn:se:nordiskamuseet:diva-503
"Almgren, Li",Adopterad till Sverige,Adoptivbarn,82.0,98.0,17.0,1996,urn:nbn:se:nordiskamuseet:diva-1712
"Keyland, Nils (Nordiska museet [877150])",Afbildningar af notredskap,Fiske;Fiskeredskap,223.0,241.0,19.0,1914,urn:nbn:se:nordiskamuseet:diva-755
"NN, nn (Nordiska museet [877150])",Afbildningar af sigillstampar tillhörande Nordiska museet,Skråväsen,43.0,45.0,3.0,1891,urn:nbn:se:nordiskamuseet:diva-188
"Sjöstedt, Yngve",Alarik Behm,Alarik Behm,167.0,170.0,4.0,1945,urn:nbn:se:nordiskamuseet:diva-961
"Szabó, Mátyás (Nordiska museet [877150])",Albert Eskeröd : 1904-1987,Nordiska museets personal;Albert Eskeröd,221.0,222.0,2.0,1988,urn:nbn:se:nordiskamuseet:diva-1600
"Waldetoft, Dan (Nordiska museet [877150])",Album och ideal : svaren på en frågelista om amatörfotografi,Amatörfotografer;Amatörfotografi;Fotografi;Nordiska museets frågelistor,122.0,139.0,18.0,2009,urn:nbn:se:nordiskamuseet:diva-1962
"Arnö-Berg, Inga (Nordiska museet [877150])",Alexis Engdahl - en skaffare i Artur Hazelius tjänst,Föremålssamlingar;Museisamlingar,43.0,56.0,14.0,1983,urn:nbn:se:nordiskamuseet:diva-1522
"Nyström, Bengt",Alf Wallander och Rörstrand - något om svensk jugendkeramik,Keramik;Keramiker;Rörstrand;Jugend,93.0,108.0,16.0,1967,urn:nbn:se:nordiskamuseet:diva-1355
"Tegnér, Torsten",Alice Tegnérs Tegnabo,Alice Tegnér;Bostäder;Djursholm,115.0,132.0,18.0,1955,urn:nbn:se:nordiskamuseet:diva-1119
"Jönsson, Bodil",Alla dessa åldrar : om livets samtidigheter,Åldrande,198.0,213.0,16.0,2015,urn:nbn:se:nordiskamuseet:diva-2102
"Dahlgren, Anna","""Alla vilja de lära sig den vackra konsten"" : om etableringen av kamera- och bildkulturer i det sena 1800-talet",Amatörfotografer;Amatörfotografi;Fotografi;1800-talet,46.0,67.0,22.0,2009,urn:nbn:se:nordiskamuseet:diva-1958
"Lithberg, Nils (Nordiska museet [877150])",Allmogeforskningen och etnologien : Installationsföreläsning å Nordiska museet 7/5 1919,Etnologi - forskning,1.0,15.0,15.0,1919,urn:nbn:se:nordiskamuseet:diva-825
"Kaijser, Lars",Allsång på Skansen : musik på museet,Skansen;Allsång,28.0,49.0,22.0,2016,urn:nbn:se:nordiskamuseet:diva-2119
"Tegman, Ulla (Nordiska museet [877150])",Alltid ulltid,Ull,30.0,43.0,14.0,2002,urn:nbn:se:nordiskamuseet:diva-1821
"Lagerquist, Marshall (Nordiska museet [877150])",Alrotsmöbler i den Clarholmska gåvan,Möbler;Möbelsnickeri,181.0,184.0,4.0,1944,urn:nbn:se:nordiskamuseet:diva-940
"Rosengren, Annette (Nordiska museet [877150])",Amatörfotografi : - minnesbilder och ljusmålningar,Amatörfotografer;Amatörfotografi;Fotografi,20.0,45.0,26.0,2009,urn:nbn:se:nordiskamuseet:diva-1957
"Bengtsson, Bengt (Nordiska museet [877150])","Amiralgeneralens ""lathund""",Museisamlingar;Nordiska museet;Sjöväsen;Pergament,58.0,74.0,17.0,1959,urn:nbn:se:nordiskamuseet:diva-1178
"Strömbom, Nils",Anders Bengtsson i Södra Fagerhult,Bonadsmåleri,161.0,166.0,6.0,1963,urn:nbn:se:nordiskamuseet:diva-1268
"Waldetoft, Dan (Nordiska museet [877150])",Anders Olsson,Amatörfotografer;Amatörfotografi;Fotografi;Anders Olsson,222.0,229.0,8.0,2009,urn:nbn:se:nordiskamuseet:diva-1980
"Daun, Åke (Nordiska museet [877150]);Klein, Barbro (Nordiska museet [877150])",Andra generationen invandrare,Andragenerationsinvandrare,6.0,14.0,9.0,1996,urn:nbn:se:nordiskamuseet:diva-1706
"Lithman, Yngve",Andra generationen och kulturell kreativitet,Andragenerationsinvandrare;Sverige,139.0,153.0,15.0,1996,urn:nbn:se:nordiskamuseet:diva-1716
"Klein, Ernst (Nordiska museet [877150])",Andra nordiska mötet för folklivsforskning i Helsingfors 14-16 augusti 1922.,Etnologi - forskning,155.0,160.0,6.0,1922,urn:nbn:se:nordiskamuseet:diva-854
"Zachrisson, Sune (Nordiska museet [877150])",Andreas Lindblom : 1889-1977,Nordiska museets personal;Andreas Lindblom,201.0,202.0,2.0,1977,urn:nbn:se:nordiskamuseet:diva-1465
"Kron, Ewa",Angelägna berättelser : gestaltningar på Skansen,Skansen;Museipedagogik,280.0,293.0,14.0,2016,urn:nbn:se:nordiskamuseet:diva-2135
"Hazelius-Berg, Gunnel (Nordiska museet [877150])","""Anjala-smycke"" eller örhänge",Örhängen;Smycken,75.0,80.0,6.0,1955,urn:nbn:se:nordiskamuseet:diva-1116
"Lindblom, Andreas (Nordiska museet [877150])",Anna Regina Khevenhüller till Julita,Julita gård,61.0,72.0,12.0,1949,urn:nbn:se:nordiskamuseet:diva-1017
"Lindblom, Andreas (Nordiska museet [877150])",Anna Rudbeck in memoriam,Anna Rudbeck;Personal i Nordiska museet,237.0,238.0,2.0,1950,urn:nbn:se:nordiskamuseet:diva-1048
"Wintzell, Inga (Nordiska museet [877150])",Anna-Maja Nylén : 1912-1976,Nordiska museets personal;Anna-Maja Nylén,300.0,301.0,2.0,1976,urn:nbn:se:nordiskamuseet:diva-1472
"Wistrand, Per Gustaf (Nordiska museet [877150])",Anteckningar af en småländsk prestfru,Prästfruar,65.0,100.0,36.0,1911,urn:nbn:se:nordiskamuseet:diva-641
"Wistrand, Per Gustaf (Nordiska museet [877150])",Anteckningar om handtverksämbeten : tunnbindarämbetet,Skråväsen,7.0,15.0,9.0,1895,urn:nbn:se:nordiskamuseet:diva-228
"Haraldsson, Mårten (Nordiska museet [877150])","Anteckningar om seder och bruk i Villstads socken, Västbo härad, i Småland under 1700-talet",,43.0,56.0,14.0,1893,urn:nbn:se:nordiskamuseet:diva-231
"Romdahl, Axel L (Nordiska museet [877150])",Anteckningar till tallrikens historia,Tallrikar,60.0,63.0,4.0,1909,urn:nbn:se:nordiskamuseet:diva-595
"NN, nn (Nordiska museet [877150])",Antikviteter till vardags,Utställningar;Nordiska museet;Antikviteter,127.0,138.0,12.0,1967,urn:nbn:se:nordiskamuseet:diva-1346
"Bengtsson, Bengt (Nordiska museet [877150])",Apoteket på Skansen,Apotek;Skansen,187.0,208.0,22.0,1934,urn:nbn:se:nordiskamuseet:diva-359
"Stavenow-Hidemark, Elisabet (Nordiska museet [877150])",Arbetarhem i Gävle : en undersökning och en utställning,Bostadsutställningar;Bostadsundersökningar;Gävle;Arbetarbostäder;1800-talet;1900-talet,179.0,190.0,12.0,1958,urn:nbn:se:nordiskamuseet:diva-1153
"Hellden, Arne (Nordiska museet [877150])",Arbetet och lyckan : kulturarvet och arbetets värde,Arbetsliv;Hantverk;Kulturarv,7.0,22.0,16.0,1984,urn:nbn:se:nordiskamuseet:diva-1544
"Rehnberg, Mats (Nordiska museet [877150])",Arbetsvandringar från Småland,Arbetsvandringar,147.0,162.0,16.0,1953,urn:nbn:se:nordiskamuseet:diva-1089
"Nyman, John (Nordiska museet [877150])",Arbetsåret på landsbygden,Arbete;Landsbygd,51.0,64.0,14.0,1973,urn:nbn:se:nordiskamuseet:diva-181
"Upmark, Gustaf (Nordiska museet [877150])",Arboga Guldsmedsämbete. Ett bidrag till kännedomen om svensk hantverksorganisation.,Guldsmeder;Skråväsen,74.0,83.0,10.0,1921,urn:nbn:se:nordiskamuseet:diva-856
"Malmgren, Curt (Nordiska museet [877150])",Arbogasilver : Några notiser från utställningen 1935,Silversmide,75.0,86.0,12.0,1936,urn:nbn:se:nordiskamuseet:diva-404
"selling, Olof H.",Arkiatern på Hammarby,Carl von Linné;Hammarby;Historia,23.0,32.0,10.0,1962,urn:nbn:se:nordiskamuseet:diva-1237
"Lindblom, Andreas (Nordiska museet [877150])",Arkitekttävlingen om Skansen,Arkitekttävlingar,217.0,224.0,8.0,1936,urn:nbn:se:nordiskamuseet:diva-413
"Bedoire, Fredric",Arkivguide för byggnadsforskare,Byggnadshistoria,29.0,68.0,40.0,1974,urn:nbn:se:nordiskamuseet:diva-1424
"Hammarlund-Larsson, Cecilia (Nordiska museet [877150])",Arktiska föremål,Nordiska museet;Museisamlingar;Föremålssamlingar;Arktis,160.0,161.0,2.0,2017,urn:nbn:se:nordiskamuseet:diva-2058
"Lagerquist, Marshall (Nordiska museet [877150])",Armfeltska gåvan till skogaholm,Skansen;Skogaholm,131.0,141.0,11.0,1959,urn:nbn:se:nordiskamuseet:diva-1182
"NN, nn (Nordiska museet [877150])",Artur Hazelius,,1.0,29.0,29.0,1903,urn:nbn:se:nordiskamuseet:diva-363
"Selling, Gösta (Nordiska museet [877150])",Artur Hazelius födelsehus : Den fritziska Sidenvävargården,,65.0,118.0,54.0,1926,urn:nbn:se:nordiskamuseet:diva-273
"Wallin, Sigurd (Nordiska museet [877150])",Artur Hazelius födelsehus : Hazeliushuset på Skansen,,119.0,168.0,50.0,1926,urn:nbn:se:nordiskamuseet:diva-274
"NN, nn (Nordiska museet [877150])",Artur Hazelius grafsättning,,1.0,3.0,3.0,1904,urn:nbn:se:nordiskamuseet:diva-414
"Bergman, Ingrid (Nordiska museet [877150])","Artur Hazelius, Nordiska museet och de första föremålsförvärven",Nordiska museet;Museisamlingar,7.0,20.0,14.0,1997,urn:nbn:se:nordiskamuseet:diva-1733
"Erixon, Sigurd (Nordiska museet [877150])",Artur Hazelius och Morastugan : ett bidrag till friluftsmuseitankens uppkomst,Bostäder;Friluftsmuséer,133.0,148.0,16.0,1940,urn:nbn:se:nordiskamuseet:diva-536
"Bringéus, Nils-Arvid (Nordiska museet [877150])",Artur Hazelius och Nordiska museet,Artur Hazelius;Nordiska museet,7.0,32.0,26.0,1972,urn:nbn:se:nordiskamuseet:diva-131
"Svärdström, Svante (Nordiska museet [877150])",Artur Hazelius och Risamålaren,Dalmåleri;Folkkonst,137.0,158.0,22.0,1937,urn:nbn:se:nordiskamuseet:diva-461
"Hals, Harald",Artur Hazelius og Norge,Artur Hazelius;Norge;Museisamlingar,101.0,112.0,12.0,1945,urn:nbn:se:nordiskamuseet:diva-954
"Berg, Gösta (Nordiska museet [877150])",Artur Hazelius utländska museistudier,Artur Hazelius;Museer,23.0,30.0,8.0,1967,urn:nbn:se:nordiskamuseet:diva-1348
"Andrén, Erik (Nordiska museet [877150]);Åberg, Alf",Arvid Horns troffétavlor och övergången av Düna,Målningar;Krig i konsten;Karl XII,7.0,22.0,16.0,1963,urn:nbn:se:nordiskamuseet:diva-1255
"Jansson, Sam Owen (Nordiska museet [877150])",Arvid Bæckström in mamoriam,Nordiska museets personal,187.0,190.0,4.0,1965,urn:nbn:se:nordiskamuseet:diva-1335
"Stenbock, C. M. (Nordiska museet [877150])",Att binda halmtak,Byggnadsteknik;Husbyggnad,46.0,50.0,5.0,1912,urn:nbn:se:nordiskamuseet:diva-659
"Tyrfelt, Annika (Nordiska museet [877150])",Att bygga ett bo...,Samtidsdokumentation;Hem;Sverige,142.0,144.0,3.0,1993,urn:nbn:se:nordiskamuseet:diva-1685
"Hidemark, Ove (Nordiska museet [877150])",Att bygga med tegel : tegeltillverkning i Skåne från hantverk till industri,Tegelbruk;Skåne,149.0,184.0,36.0,1982,urn:nbn:se:nordiskamuseet:diva-1517
"Lund, Kristina (Nordiska museet [877150]);Svensson, Birgitta (Nordiska museet [877150])",Att designa sig själv,Design;Varumärken,40.0,56.0,17.0,2005,urn:nbn:se:nordiskamuseet:diva-1867
"Biörnstad, Arne (Nordiska museet [877150])",Att flytta hus till museum,Friluftsmuseer;Kulturmiljövård;Skansen;Byggnader,107.0,122.0,16.0,1974,urn:nbn:se:nordiskamuseet:diva-1427
"Thorbech, Åsa (Nordiska museet [877150])",Att fånga bilden av landskapet,Landskapsfotografi;Carl Fries,53.0,77.0,25.0,1988,urn:nbn:se:nordiskamuseet:diva-1591
"Kuoljock, Sunna",Att göra ett samiskt kulturarv synligt,Samer;Historia;Kulturarv,253.0,267.0,15.0,2008,urn:nbn:se:nordiskamuseet:diva-1954
"Hamilton, Ulf (Nordiska museet [877150])",Att hålla döden på avstånd : - om vård och konservering av vårt kulturarv,Museisamlingar;Konservering;Kulturarv;Kulturmiljövård,253.0,262.0,10.0,1983,urn:nbn:se:nordiskamuseet:diva-1541
"Söderlind-Myrdal, Ingrid (Nordiska museet [877150])",Att kärna smör,Smörkärnor;Smör,173.0,186.0,14.0,1977,urn:nbn:se:nordiskamuseet:diva-1463
"Lagercrantz, Bo (Nordiska museet [877150])",Att leva flink floribus,Museisamlingar;Nordiska museet;Dryckeskärl,194.0,196.0,3.0,1959,urn:nbn:se:nordiskamuseet:diva-1192
"Ambrosiani, Aron (Nordiska museet [877150])",Att skriva kulturhistoria : Ett skolprojekt om Wikipedia,Skolprojekt;Wikipedia;Gymnmasiearbetet,48.0,61.0,14.0,2017,urn:nbn:se:nordiskamuseet:diva-2040
"Sjöqvist, Kerstin (Nordiska museet [877150])",Att skura golv,Städning,131.0,142.0,12.0,1970,urn:nbn:se:nordiskamuseet:diva-1415
"Cederlund, Carl Olof","""Att supa tobak"" : en översikt över tobaksbrulets äldsta historia i Sverige",Tobaksrökning;Sverige;1600-talet,41.0,54.0,14.0,1967,urn:nbn:se:nordiskamuseet:diva-1338
"Wallin, Leif (Nordiska museet [877150])",Att vara och leva poly,Polyamori,213.0,220.0,8.0,2012,urn:nbn:se:nordiskamuseet:diva-2006
"NN, nn (Nordiska museet [877150])",Attentat mot Majstänger i Fårö kyrka 1758,Majstänger,71.0,72.0,2.0,1918,urn:nbn:se:nordiskamuseet:diva-814
"Eklund Nyström, Sigrid (Nordiska museet [877150])",August Strindberg hade ingen Strindbergslampa,August Strindberg;Heminredning;Museisamlingar,160.0,169.0,10.0,1997,urn:nbn:se:nordiskamuseet:diva-1747
"Jirlow, Ragnar (Nordiska museet [877150])","August Strindberg, Hemsöborna och verkligheten",August Strindberg;Kymmendö,21.0,40.0,20.0,1945,urn:nbn:se:nordiskamuseet:diva-949
"Bergman, Ingrid (Nordiska museet [877150])",Augusta Lundin vår första modedirektris,Modehus;Augusta Lundin;1800-talet;1900-talet;Sverige,96.0,100.0,5.0,1988,urn:nbn:se:nordiskamuseet:diva-1606
"Lundwall, Sten (Nordiska museet [877150])",Axel Nyströms göticism,Gotisk konst;Axel Nyström;Arkitektur,7.0,30.0,24.0,1959,urn:nbn:se:nordiskamuseet:diva-1175
"Rosengren, Annette (Nordiska museet [877150])","Axel och Frida Fredriksson, Johan och Augusta Larsson",Amatörfotografer;Amatörfotografi;Fotografi;Axel Fredriksson;Frida Fredriksson;Johan Larsson;Augusta Larsson,180.0,183.0,4.0,2009,urn:nbn:se:nordiskamuseet:diva-1971
"Bergman, Ingrid (Nordiska museet [877150])",Axel von Fersens franska modedräkt från 1780-talet,Herrkläder;1700-talet;Axel von Fersen,88.0,94.0,7.0,1993,urn:nbn:se:nordiskamuseet:diva-1680
"Berg, Jonas (Nordiska museet [877150])","Bagare, brödbodar och näringsfrihet",Bagare;Näringsfrihet,59.0,70.0,12.0,1982,urn:nbn:se:nordiskamuseet:diva-1512
"Frisk, Tomas",Baltic Sea science Center,Skansen,224.0,225.0,2.0,2017,urn:nbn:se:nordiskamuseet:diva-2066
"Lindström, Ulla (Nordiska museet [877150])",Barn och utlänningar,Barn;Främlingar;Sverige,211.0,231.0,21.0,1991,urn:nbn:se:nordiskamuseet:diva-1663
"Szabó, Mátyás (Nordiska museet [877150])",Barnarbete i agrarsamhället,,19.0,38.0,20.0,1971,urn:nbn:se:nordiskamuseet:diva-121
"Kvideland, Reimund",Barnetru : Ein faktor i den kulturelle innlæringsprocessen,Folktro;Norden,233.0,254.0,22.0,1976,urn:nbn:se:nordiskamuseet:diva-1467
"Rentzhog, Sten (Nordiska museet [877150])",Barnets århundrade,Barn;Museipedagogik;Nordiska museet,9.0,15.0,7.0,1991,urn:nbn:se:nordiskamuseet:diva-1646
"Palmenfelt, Ulf (Nordiska museet [877150])",Barns egen folklore,Folklore;Folktro,182.0,199.0,18.0,1991,urn:nbn:se:nordiskamuseet:diva-1661
"Biörnstad, Arne (Nordiska museet [877150])",Barns lekmiljö med utgångspunkt från Skansen,Barn;lek;Skansen,97.0,106.0,10.0,1971,urn:nbn:se:nordiskamuseet:diva-126
"Myrström, Fiffi (Nordiska museet [877150])",Barnstolen Parupu,Barnmöbler,266.0,267.0,2.0,2015,urn:nbn:se:nordiskamuseet:diva-2111
"Wallin, Sigurd (Nordiska museet [877150])",Barocksängar i kyrkobruk,Barockkonst;Sängar;1600-talet;Kyrklig konst,93.0,106.0,14.0,1963,urn:nbn:se:nordiskamuseet:diva-1261
"Talve, Ilmar (Nordiska museet [877150])",Bastu och badstugor,Personlig hygien;Bastu;Badvanor,55.0,68.0,14.0,1970,urn:nbn:se:nordiskamuseet:diva-1410
"Ljungdahl, D (Nordiska museet [877150])",Bastu vid Backa Väddö,Bastu - Historia,116.0,119.0,4.0,1909,urn:nbn:se:nordiskamuseet:diva-601
"Hazelius-Berg, Gunnel (Nordiska museet [877150])",Beata Jaquette Ribbings mönstersamling,Mönsterblad;Broderimönster,49.0,66.0,18.0,1948,urn:nbn:se:nordiskamuseet:diva-1000
"Olsson, Marianne (Nordiska museet [877150])",Bebyggelse i Noraskog,Byggnader;Noraskog;Järn;Bergslagen,168.0,172.0,5.0,1959,urn:nbn:se:nordiskamuseet:diva-1185
"Andrén, Erik (Nordiska museet [877150])",Bebyggelsen på Svindersvik,Svindersvik;Byggnader,33.0,66.0,34.0,1951,urn:nbn:se:nordiskamuseet:diva-1051
"Erixon, Sigurd (Nordiska museet [877150])",Bebyggelseundersökningar : Öfversikt. Periodiska bebyggelsetyper. Fäbodväsen.,Fäbodar;Bebyggelse - historia,21.0,57.0,37.0,1918,urn:nbn:se:nordiskamuseet:diva-811
"Hammarstedt, Nils Edvard (Nordiska museet [877150])",Behandling för engelska sjukan på 1850-talet,Sjukdomar;Folkmedicin,30.0,32.0,3.0,1892,urn:nbn:se:nordiskamuseet:diva-197
"Berg, Gösta (Nordiska museet [877150])","""Behyvlingen"" i Enköpings snickerigesällskap",Skråväsen;Snickare,201.0,208.0,8.0,1936,urn:nbn:se:nordiskamuseet:diva-412
"Nylén, Anna-Maja (Nordiska museet [877150])",Beklädnadsindustrin och modet,Beklädnadsindustri;Mode;Sverige;1800-talet;1900-talet,29.0,50.0,22.0,1968,urn:nbn:se:nordiskamuseet:diva-1373
"Alexandersson, Anna",Bekännelser från ett dansbandsgolv,Dansband;Vykort,209.0,219.0,11.0,2006,urn:nbn:se:nordiskamuseet:diva-1919
"Byström, Olof",Bellman hos börsarkitekten,Carl Michael Bellman,179.0,188.0,10.0,1951,urn:nbn:se:nordiskamuseet:diva-1059
"Afzelius, Nils",Bellmans familjebibel i autografsamlarhänder,Carl Michael Bellman,163.0,178.0,16.0,1951,urn:nbn:se:nordiskamuseet:diva-1058
"Steile, Ove B (Nordiska museet [877150])","Beretning om julens feirende i Vang, Valders i Norge omkring år 1860",Julseder;Norge,33.0,39.0,7.0,1892,urn:nbn:se:nordiskamuseet:diva-198
"Steile, Ove B (Nordiska museet [877150])","Beretning om overtro og heksekunster i Vang, Valders, Norge : ur Nordiska museets arkiv",Folktro;Magi/Kult,62.0,74.0,13.0,1895,urn:nbn:se:nordiskamuseet:diva-234
"Hammarstedt, Nils Edvard (Nordiska museet [877150])",Bernhard Salin : Några minnesord,,271.0,276.0,6.0,1932,urn:nbn:se:nordiskamuseet:diva-290
"Lagerquist, Marshall (Nordiska museet [877150])",Bestick från Karl XIs tid,Bestick,212.0,213.0,2.0,1941,urn:nbn:se:nordiskamuseet:diva-881
"Törngren, Linda",Bevarandet av mångfald : Berguv och vitryggig hackspett,Skansen;Fåglar;Bevarande,226.0,235.0,10.0,2017,urn:nbn:se:nordiskamuseet:diva-2067
"Svärdström, Svante (Nordiska museet [877150])",Bibel på väv och mur : en norrländsk målarskola under stormaktstiden,Allmogekonst;Vävda tapeter,27.0,44.0,18.0,1953,urn:nbn:se:nordiskamuseet:diva-1081
"Hammarstedt, Nils Edvard (Nordiska museet [877150])",Bibliografi över N Keylands etnologiska författarskap,,29.0,33.0,5.0,1925,urn:nbn:se:nordiskamuseet:diva-676
"Ängkvist, Mathilda (Nordiska museet [877150])",Biblioteket och modet,Nordiska museets bibliotek;Modetidningar;Bibliotekssamlingar;Mode,124.0,125.0,2.0,2017,urn:nbn:se:nordiskamuseet:diva-2050
"Ulrich, Arvid (Nordiska museet [877150])",Bidrag till brödförsäljningsprisets historia,Bröd,223.0,234.0,12.0,1909,urn:nbn:se:nordiskamuseet:diva-612
"Hirvonen, Vuokko",Bild och text hand i hand : om mångkunniga samiska författare,Samiska författare;Samisk litteratur,186.0,203.0,18.0,2008,urn:nbn:se:nordiskamuseet:diva-1950
"Sörlin, Sverker","Bilden av bilderna. Åtta anteckningar om fotografiet och ""det svenska landskapet""",Fotografi;Landskap;Sverige,22.0,67.0,46.0,2011,urn:nbn:se:nordiskamuseet:diva-1991
"Berggren Torell, Viveka",Bilder av tweens,Barnkläder;Ungdomar som konsumenter,64.0,65.0,2.0,2015,urn:nbn:se:nordiskamuseet:diva-2089
"Ekström, Gert",Bilens historia före 1900,Bilar;Sverige;1800-talet,38.0,69.0,32.0,1996,urn:nbn:se:nordiskamuseet:diva-1719
"Tengström, Emin",Bilismen inför framtiden,Bilar;Sverige;Bilism,23.0,37.0,15.0,1996,urn:nbn:se:nordiskamuseet:diva-1718
"Hagman, Olle (Nordiska museet [877150])",Bilreklamen och det goda livet,Bilreklam,206.0,223.0,18.0,1996,urn:nbn:se:nordiskamuseet:diva-1727
"Hammarstedt, Nils Edvard (Nordiska museet [877150])",Bistockar,Biodling,22.0,26.0,5.0,1907,urn:nbn:se:nordiskamuseet:diva-541
"Hammarstedt, Nils Edvard (Nordiska museet [877150])",Björnen i idet,Björnar,159.0,160.0,2.0,1918,urn:nbn:se:nordiskamuseet:diva-822
"Hämäläinen, Albert (Nordiska museet [877150])",Björnklubban i den primitiva biskötselns tjänst,Jaktmetoder;Jakt,131.0,140.0,10.0,1935,urn:nbn:se:nordiskamuseet:diva-376
"Stadling, J (Nordiska museet [877150])",Björnupptåg i Oviksfjällen,Bröllop;Lekar;Samer,256.0,,,1913,urn:nbn:se:nordiskamuseet:diva-732
"Sännås, Per-Olof",Black Armys tjejer,Fanklubbar;Fotboll;Bollsport,184.0,197.0,14.0,2000,urn:nbn:se:nordiskamuseet:diva-1780
"Berg, Kerstin G:son (Nordiska museet [877150])",Blandstopen - haarikka-kärl i Nordiska museet,Föremålssamlingar;Museisamlingar;Kärl,145.0,152.0,8.0,1983,urn:nbn:se:nordiskamuseet:diva-1530
"Fett, Harry (Nordiska museet [877150])",Blomstermestern fra Ringebu,Växtornamentik;Dekorationsmålning;Folkkonst,213.0,225.0,13.0,1904,urn:nbn:se:nordiskamuseet:diva-416
"Lagerquist, Marshall (Nordiska museet [877150])",Blomstermålning i trä,Möbelkonst;1700-talet;Intarsia;Sverige,51.0,62.0,12.0,1962,urn:nbn:se:nordiskamuseet:diva-1239
"Nylén, Anna-Maja (Nordiska museet [877150])",Blåblusen och andra blusar,Kläder;Blusar,109.0,124.0,16.0,1967,urn:nbn:se:nordiskamuseet:diva-1356
"Fant, Erik (Nordiska museet [877150])",Bogesunds slott,Arkitektur;Slott,17.0,44.0,28.0,1947,urn:nbn:se:nordiskamuseet:diva-979
"Wistrand, Per Gustaf (Nordiska museet [877150])",Bohusländska folkdräkter,Folkdräkter,1.0,18.0,18.0,1908,urn:nbn:se:nordiskamuseet:diva-568
"Johansson, Selma (Nordiska museet [877150])",Bohusländskt ullberedning i äldre och nuvarande tid,Ull;Ylle;Tyger;Hantverk,187.0,192.0,6.0,1928,urn:nbn:se:nordiskamuseet:diva-483
"Erixon, Sigurd (Nordiska museet [877150])",Bollnässtugan och dess gårdsmiljö,Byggnader;Parstugor,132.0,146.0,15.0,1922,urn:nbn:se:nordiskamuseet:diva-852
"Jonsson, Pernilla (Nordiska museet [877150])",Bomullstygets genombrott,Bomullstyger,44.0,59.0,16.0,2002,urn:nbn:se:nordiskamuseet:diva-1822
"Rehnberg, Mats (Nordiska museet [877150])",Bomärken som hjälpmedel i forskningen,Bomärken,205.0,218.0,14.0,1951,urn:nbn:se:nordiskamuseet:diva-1062
"Strömbom, Nils",Bonadsmålare och möbelmålare i Knäredstrakten,Möbelmåleri;Bonadsmåleri;Knäred;Folkkonst,165.0,188.0,24.0,1956,urn:nbn:se:nordiskamuseet:diva-1135
"Eriksson, Manne (Nordiska museet [877150])",Bondeliv i norra Uppland,Vardagsliv;Bondesamhället,65.0,120.0,56.0,1925,urn:nbn:se:nordiskamuseet:diva-682
"Flinck, Maria",Bondens trädgård,Trädgårdar,113.0,130.0,18.0,1999,urn:nbn:se:nordiskamuseet:diva-1765
"Hofrén, Manne (Nordiska museet [877150])",Bondesnickaren Zakris Pehrsson,Snickare,129.0,138.0,10.0,1920,urn:nbn:se:nordiskamuseet:diva-766
"Nyman, Anders (Nordiska museet [877150])",Bondsaxar,Saxar;Smideshantverk;Sverige;Bondekultur,51.0,66.0,16.0,1964,urn:nbn:se:nordiskamuseet:diva-1299
"Nordström, Ingrid (Nordiska museet [877150])",Bordsskick - ett spel om gemenskap,Etikettfrågor,37.0,51.0,15.0,1989,urn:nbn:se:nordiskamuseet:diva-1635
"Andrén, Erik (Nordiska museet [877150])",Bordsur från tiden omkring 1820,Ur (tidmätare);1800-talet;Empir;Sverige,205.0,206.0,2.0,1963,urn:nbn:se:nordiskamuseet:diva-1282
"Olsson, Marianne (Nordiska museet [877150])",Borgerlig möblering i Stockholm på 1600-talet,Heminredning;1600-talet;Möbler,137.0,146.0,10.0,1957,urn:nbn:se:nordiskamuseet:diva-1148
"NN, nn (Nordiska museet [877150])",Borgerlig rumsinteriör från 1798,Interiörer,44.0,46.0,3.0,1907,urn:nbn:se:nordiskamuseet:diva-548
"Bæckström, Arvid (Nordiska museet [877150])",Borgerskapets majfest för Uppsala studentkår 1849 : text till en tavla,Majfester;Studentfester;1800-talet;Uppsala,125.0,136.0,12.0,1945,urn:nbn:se:nordiskamuseet:diva-957
"Rosengren, Annette (Nordiska museet [877150])",Boris Larsson,Amatörfotografer;Amatörfotografi;Boris Larsson,230.0,235.0,6.0,2009,urn:nbn:se:nordiskamuseet:diva-1981
"Upmark, Gustaf (Nordiska museet [877150])",Boråsguldsmederna och deras stämplar,Guldsmeder,171.0,182.0,12.0,1915,urn:nbn:se:nordiskamuseet:diva-788
"Terént, Mia (Nordiska museet [877150])",Bostaden berättar : om boktryckarens hem på Skansen,Skansen;Byggnader;Boktryckarbostaden,270.0,289.0,20.0,2013,urn:nbn:se:nordiskamuseet:diva-2034
"Lundberg, Egron",Bref från Egron Lundgren till hans broder,,140.0,142.0,3.0,1900,urn:nbn:se:nordiskamuseet:diva-307
"Nicander, Karl August;Schantz, von, M G",Bref från Karl August Nicander till MG von Schantz,,136.0,139.0,4.0,1900,urn:nbn:se:nordiskamuseet:diva-306
"Tornberg, Monica",Brev från barn,Museipedagogik;Skansen,62.0,63.0,2.0,2017,urn:nbn:se:nordiskamuseet:diva-2041
"Ulvenstam, Lars;Ulvenstam, Lena",Brevet från kolonin,Koloniträdgårdar,182.0,209.0,28.0,2003,urn:nbn:se:nordiskamuseet:diva-1848
"Sjögren, Annick","Brist på respekt, men för vem?",Invandrare;Sverige;Skolan,60.0,81.0,22.0,1996,urn:nbn:se:nordiskamuseet:diva-1711
"Strömgren, Elisabeth (Nordiska museet [877150])",Broderade hängkläden från Blekinge,Hängkläden;Broderier;Folklig textil;Blekinge,163.0,174.0,12.0,1950,urn:nbn:se:nordiskamuseet:diva-1040
"Falkberget, Johan (Nordiska museet [877150])",Broderfolkenes åndelige union : tal på Skansen vid härjedalens dag den 6 juli 1947,Härjedalen,201.0,208.0,8.0,1948,urn:nbn:se:nordiskamuseet:diva-1011
"Hammarstedt, Nils Edvard (Nordiska museet [877150])",Brorskål och blodsförbund,,220.0,229.0,10.0,1908,urn:nbn:se:nordiskamuseet:diva-583
