Name,Title,Keywords,StartPage,EndPage,Pages,Year,NBN
"Enqvist, Arvid (Nordiska museet [877150])",Kulturhistoriska notiser och traditioner från 1600-talet från Öland och Småland,Kulturhistoria,16.0,36.0,21.0,1930,urn:nbn:se:nordiskamuseet:diva-330
"Hansson, Hans (Nordiska museet [877150])",Kulturhistoriskt avskräde,Stockholm;Historia,187.0,196.0,10.0,1970,urn:nbn:se:nordiskamuseet:diva-1419
"Koctürk, Tahire",Kulturspecifika kolhydrater,Mat och dryck;Kulturell identitet;Kolhydrater,157.0,162.0,6.0,2001,urn:nbn:se:nordiskamuseet:diva-1810
"Bonge, Inger (Nordiska museet [877150])",Kunglig koppar,Koppararbeten,145.0,150.0,6.0,1962,urn:nbn:se:nordiskamuseet:diva-1250
"Axel-Nilsson, Christian (Nordiska museet [877150])",Kungliga Boktryckeriets stilgjuteri i Stockholm,Boktryckerier;Stockholm;Typsnitt,45.0,60.0,16.0,1963,urn:nbn:se:nordiskamuseet:diva-1258
"Thorman, Elisabeth (Nordiska museet [877150])",Kungligt dukfragment i Nordiska Museet,Duktyg;Dukar,79.0,88.0,10.0,1937,urn:nbn:se:nordiskamuseet:diva-457
"Wallin, Sigurd (Nordiska museet [877150])",Kungsberget på Svecians Strängnäsbild,Strängnäs;Erik Dahlberg;Suecia antiqa et hodierna;1700-talet,183.0,196.0,14.0,1967,urn:nbn:se:nordiskamuseet:diva-1363
"NN, nn",Kungsord om Skansen : tal av H. M. Konungen vid Sollidens invigning den 29 april 1952,Solliden;Skansen,7.0,8.0,2.0,1953,urn:nbn:se:nordiskamuseet:diva-1079
"Rudberg, Gunnar (Nordiska museet [877150])",Kvarnstenstillverkningen i Lugnås,Stenhuggeri;Stenhuggare;Kvarnstenar,210.0,231.0,22.0,1906,urn:nbn:se:nordiskamuseet:diva-448
"Lindblom, Andreas (Nordiska museet [877150])","""Kvinnans list övergår mannens förstånd"" : En studie i Anders Zorns samlingar.",Textil;Bildanalys,175.0,184.0,10.0,1931,urn:nbn:se:nordiskamuseet:diva-255
"Johansson, Selma (Nordiska museet [877150])","Kvinnlig hemslöjd i Torsby, Lycke och Harestads socknar i Bohuslän",Hemslöjd;Handarbete,51.0,56.0,6.0,1927,urn:nbn:se:nordiskamuseet:diva-386
"Österman, Annika (Nordiska museet [877150])",Kvinnor och kor,Nordiska museets frågelistor;Boskapsskötsel;Kor,65.0,76.0,12.0,1986,urn:nbn:se:nordiskamuseet:diva-1574
"Bergman, Ingrid (Nordiska museet [877150])",Kvinnorna och byxorna,Byxor;Kvinnor;Damkläder,32.0,55.0,24.0,1988,urn:nbn:se:nordiskamuseet:diva-1603
"NN, nn (Nordiska museet [877150])",Kyrkhelg i  Norrbotten,Norrbotten;Kyrkan,179.0,188.0,10.0,1968,urn:nbn:se:nordiskamuseet:diva-1385
"Boëthius, Gerda (Nordiska museet [877150])",Kyrkhärbret i Älvdalen,Trä;Byggnadsmaterial;Ornamentik,129.0,144.0,16.0,1931,urn:nbn:se:nordiskamuseet:diva-252
"Andersson, Aron (Nordiska museet [877150])",Kyrkligt eller profant? : ett par sörmländska oblatskrin,Skrin;Oblatskrin,45.0,56.0,12.0,1947,urn:nbn:se:nordiskamuseet:diva-983
"Rattfelt, Anette",Känn dig själv! : om strävanden på gym,Gym;Träning,236.0,259.0,24.0,2000,urn:nbn:se:nordiskamuseet:diva-1787
"Kristensson, Karolina (Nordiska museet [877150])","Känna igen : Stockholms central, hösten 2015",Fotografi;Samtidsdokumentation;Flyktingar,80.0,85.0,6.0,2017,urn:nbn:se:nordiskamuseet:diva-2043
"Hagberg, Louise (Nordiska museet [877150])",Käpp och krycka och kryckeståt,Bröllop;Gåvor,129.0,146.0,18.0,1915,urn:nbn:se:nordiskamuseet:diva-784
"Brundin, Elisabeth (Nordiska museet [877150])",Kära far och mor låna mig lite mjöl och salt...,Lekar;Rim,166.0,181.0,16.0,1991,urn:nbn:se:nordiskamuseet:diva-1660
"Waldetoft, Dan (Nordiska museet [877150])",Kärlek bland annat,Fotografi;Bröllop;Sverige;Kärlek,36.0,51.0,16.0,2012,urn:nbn:se:nordiskamuseet:diva-2004
"Hedberg, Jonas (Nordiska museet [877150])",Kärlek in på bara skinnet,Tatuering;Kärlek;Hjärta i konsten,146.0,157.0,12.0,2012,urn:nbn:se:nordiskamuseet:diva-2014
"Knutsson, Johan (Nordiska museet [877150])",Kärleksgåvor,Friargåvor;Kärlek;Trolovning,170.0,189.0,20.0,1994,urn:nbn:se:nordiskamuseet:diva-1700
"Kättström Höök, Lena (Nordiska museet [877150])",Kärlekslås : - en ritual för evig kärlek,Kärlek;Kärlekslås,93.0,111.0,19.0,2012,urn:nbn:se:nordiskamuseet:diva-2008
"NN, nn (Nordiska museet [877150])",Kåsor,Dryckeskärl,91.0,,,1915,urn:nbn:se:nordiskamuseet:diva-778
"Lundwall, Sten (Nordiska museet [877150])",L. J. von Röök : en museiman under romantiken,Museimän;Sverige,77.0,92.0,16.0,1957,urn:nbn:se:nordiskamuseet:diva-1142
"Ambrosiani, Sune (Nordiska museet [877150])","Lada vid Biskops Bunge Socken, Gottland.",Lador,37.0,50.0,14.0,1921,urn:nbn:se:nordiskamuseet:diva-858
"Virtanen, Lea (Nordiska museet [877150])",Lagom lycka är bäst : Magiska föreställningar i dag,Magi,255.0,268.0,14.0,1976,urn:nbn:se:nordiskamuseet:diva-1468
"Ambrosiani, Sune (Nordiska museet [877150])",Lambgiftar,Fårskötsel;Ladugårdar;Lantbruksbyggnader,235.0,239.0,5.0,1909,urn:nbn:se:nordiskamuseet:diva-613
"Saltzman, Katarina",Landsbygdens vårdande landskap och stadens vilda natur,Landsbygd;Landskap;Städer;Natur,192.0,209.0,18.0,2011,urn:nbn:se:nordiskamuseet:diva-1998
"Lindström, Ulla (Nordiska museet [877150])",Landsbygdspojkar och husdjur,Nordiska museets frågelistor;Boskapsskötsel;Bönder;Djurhållning,133.0,142.0,10.0,1986,urn:nbn:se:nordiskamuseet:diva-1581
"Rosengren, Annette (Nordiska museet [877150])","Landskap, fotografi och bygdeundersökningar",Fotografi;Landskap;Byundersökningar,68.0,87.0,20.0,2011,urn:nbn:se:nordiskamuseet:diva-1992
"Landin, Mats (Nordiska museet [877150]);Westergren, Christina (Nordiska museet [877150])",Landskap i vägen,Landskap;Sverige,186.0,191.0,6.0,2011,urn:nbn:se:nordiskamuseet:diva-1997
"Ahnlund Berg, Charlotte",Landskapande,Skansen;Landskap;Miljöer,121.0,145.0,25.0,2011,urn:nbn:se:nordiskamuseet:diva-1994
"Waldetoft, Dan (Nordiska museet [877150])",Landskapets nya uppstickare,Kulturlandskap;Kulturgeografi,250.0,259.0,10.0,2011,urn:nbn:se:nordiskamuseet:diva-2001
"Kjellström, Rolf (Nordiska museet [877150])",Lapparnas frierier och bröllop,Samer;Bröllop;Frieri,193.0,218.0,26.0,1969,urn:nbn:se:nordiskamuseet:diva-1402
"Granlund, John (Nordiska museet [877150])",Lapparnas lasso,Samer;Historia,7.0,32.0,26.0,1964,urn:nbn:se:nordiskamuseet:diva-1296
"Svenonius, Fredrik (Nordiska museet [877150])",Lapparnes renmärken : ett etnografiskt-juridiskt bidrag,Samer;Djurhållning,39.0,42.0,4.0,1895,urn:nbn:se:nordiskamuseet:diva-230
"Sommarström, Bo (Nordiska museet [877150])",Lappmarksinventeringarna,Fältundersökningar;Samer,128.0,134.0,7.0,1965,urn:nbn:se:nordiskamuseet:diva-1327
"Hallström, Gustaf (Nordiska museet [877150])",Lapptrumman,Samiska ceremonitrummor,81.0,104.0,24.0,1910,urn:nbn:se:nordiskamuseet:diva-623
"Palm, Axel (Nordiska museet [877150])",Lapptrumman från Åsele,Samiska ceremonirummor,48.0,,,1910,urn:nbn:se:nordiskamuseet:diva-621
"Klein, Ernst (Nordiska museet [877150])",Lapsk hornslöjd och nordiskt silversmide,Sameslöjd;Hornslöjd;Silversmide,65.0,88.0,24.0,1922,urn:nbn:se:nordiskamuseet:diva-847
"Keyland, Nils (Nordiska museet [877150])",Lapska fångst- och fiskeredskap,Fiske;Samer,65.0,80.0,16.0,1910,urn:nbn:se:nordiskamuseet:diva-622
"Manker, Ernst (Nordiska museet [877150])",Lapska kulturrester : några intryck och erfarenheter från Nordiska museets lappmarksinventering 1943,Samer;Samtidsdokumentation,77.0,100.0,24.0,1945,urn:nbn:se:nordiskamuseet:diva-952
"Wiklund, K B (Nordiska museet [877150])",Lapska seder och föreskrifter rörande mat och matlagning,Samer;Minoriteter;Mat;Matlagning,1.0,12.0,12.0,1902,urn:nbn:se:nordiskamuseet:diva-309
"Jansson, Sam Owen (Nordiska museet [877150])",Laura Stridsberg : 1884-1976,Nordiska museets personal;Laura Stridsberg,298.0,299.0,2.0,1976,urn:nbn:se:nordiskamuseet:diva-1471
"Knutsdotter Olofsson, Birgitta",Lek för livet,Lekar,28.0,57.0,30.0,1991,urn:nbn:se:nordiskamuseet:diva-1650
"Almqvist, Birgitta",Lek och leksaker förr och nu,Lekar;Leksaker;Historia,58.0,85.0,28.0,1991,urn:nbn:se:nordiskamuseet:diva-1651
"Maxén, Maria (Nordiska museet [877150])",Leka blindbock,Lekar,214.0,237.0,24.0,2014,urn:nbn:se:nordiskamuseet:diva-2084
"Hemming, Ulrika (Nordiska museet [877150])",Leka på vintern,Lekar;Vintern,140.0,151.0,12.0,1991,urn:nbn:se:nordiskamuseet:diva-1658
"Svärdström, Svante (Nordiska museet [877150])",Leksandsmålaren Jufwas Anders Ersson i Västerdalarna,Dalmålningar,81.0,98.0,18.0,1967,urn:nbn:se:nordiskamuseet:diva-1342
"Holmqvist, Klara (Nordiska museet [877150])",Levande kultur : trädgården på Julita gård,Julita gård;Trädgårdar,204.0,223.0,20.0,2017,urn:nbn:se:nordiskamuseet:diva-2065
"Svanberg, Ingvar",Levande samlingar : djuren på Skansen,Skansen;Djurparker,82.0,103.0,22.0,2016,urn:nbn:se:nordiskamuseet:diva-2123
"NN, nn (Nordiska museet [877150])",Lilit i Norrland,Folktro,241.0,,,1908,urn:nbn:se:nordiskamuseet:diva-586
"Oxhammar, Greger (Nordiska museet [877150])",Lillemor Kihlskog : 1921-1984,Nordiska museets personal;Lillemor Kihlskog,177.0,177.0,1.0,1984,urn:nbn:se:nordiskamuseet:diva-1556
"Lindblom, Andreas (Nordiska museet [877150])",Lillies och Fersens Löfstad,Byggnader;Löfstad,7.0,36.0,30.0,1961,urn:nbn:se:nordiskamuseet:diva-1222
"Keyland, Nils (Nordiska museet [877150])",Linberedningsverk : Några ord med anledning av ett nyförvärv till Skansens byggnadsmuseum.,Lin - bearbetning,124.0,151.0,28.0,1921,urn:nbn:se:nordiskamuseet:diva-859
"Jobs Arnberg, Anna-Karin (Nordiska museet [877150])",Lindan,Barnavård;Historia,38.0,39.0,2.0,2015,urn:nbn:se:nordiskamuseet:diva-2087
"Hagberg, Louise (Nordiska museet [877150])",Linmagi,Lin;Folktro,115.0,117.0,3.0,1923,urn:nbn:se:nordiskamuseet:diva-703
"Cederblom, Gerda (Nordiska museet [877150])",Linnedamast i Nordiska Museet,Damast;Linne,243.0,256.0,14.0,1907,urn:nbn:se:nordiskamuseet:diva-566
"Reuterskiöld, Edgar (Nordiska museet [877150]);Wiklund, K. B.",Linnes lapska trolltrumma 2,Samiska ceremonitrummor,129.0,169.0,41.0,1912,urn:nbn:se:nordiskamuseet:diva-665
"Wallin, Sigurd (Nordiska museet [877150]) (Stiftelsen Nordiska museet)",Linnéminnen i Nordiska museet,Museisamlingar;Carl von Linné,141.0,152.0,12.0,1950,urn:nbn:se:nordiskamuseet:diva-1038
"Reuterskiöld, Edgar (Nordiska museet [877150])",Linnés lapska trolltrumma : En Linnéreliks öde,Samiska ceremonitrummor,15.0,19.0,5.0,1910,urn:nbn:se:nordiskamuseet:diva-619
"Näsström, Gustaf (Nordiska museet [877150])",Linnés århundrade - en svensk blomstringstid,Historia;Sverige;1700-talet,7.0,22.0,16.0,1962,urn:nbn:se:nordiskamuseet:diva-1236
"Okänd, Okänd (Nordiska museet [877150])",Liten Kersti : folkvisa från Dalsland,Folkvisor,28.0,30.0,3.0,1890,urn:nbn:se:nordiskamuseet:diva-220
"Grahn, Wera (Nordiska museet [877150])",Liv utan bil,Resor,242.0,255.0,14.0,1996,urn:nbn:se:nordiskamuseet:diva-1729
"Hammarskjöld, Carl",Livet på SVnindersvik under 1900-talet,Svindersvik;Byggnader,121.0,132.0,12.0,1953,urn:nbn:se:nordiskamuseet:diva-1087
"Fleetwood, Georg W (Nordiska museet [877150])",Livrustkammarens metodför avbildning av vapenstämplar,Vapen,84.0,87.0,4.0,1921,urn:nbn:se:nordiskamuseet:diva-860
"Wallin, Sigurd (Nordiska museet [877150])",Ljuskronan från Östra Ryds kyrka,Lampor;Ljuskronor;Belysniong,160.0,176.0,17.0,1921,urn:nbn:se:nordiskamuseet:diva-861
"Waldetoft, Dan (Nordiska museet [877150])",Ljuspunkter,Belysning,166.0,171.0,6.0,2013,urn:nbn:se:nordiskamuseet:diva-2028
"Terént, Mia",Loppor och löss går igen,Loppor;Löss,166.0,183.0,18.0,2004,urn:nbn:se:nordiskamuseet:diva-1861
"Rosander, Eva (Nordiska museet [877150])","Loppor och löss, råttor och möss",Loppor;Personlig hygien;Skadedjur,101.0,114.0,14.0,1970,urn:nbn:se:nordiskamuseet:diva-1413
"Dahlman, Eva",Lotten von Düben,,142.0,145.0,4.0,2009,urn:nbn:se:nordiskamuseet:diva-1964
"Wikman, K. Rob. V. (Nordiska museet [877150])",Louise Hagberg,Louise Hagberg,171.0,174.0,4.0,1945,urn:nbn:se:nordiskamuseet:diva-962
"Axel-Nilsson, Göran (Nordiska museet [877150])",Lovsätra : en liten herrgård och dess trevnad,Herrgårdar;1700-talet,19.0,48.0,30.0,1946,urn:nbn:se:nordiskamuseet:diva-973
"Österman, Annika (Nordiska museet [877150])",Lucia,Luciafirande;Nordiska museets frågelistor,195.0,198.0,4.0,1964,urn:nbn:se:nordiskamuseet:diva-1311
"Johansson, Levi (Nordiska museet [877150]);Hammarstedt, Nils Edvard (Nordiska museet [877150])",Lucia och de underjordiske i norrländsk folksägen + Tillägg,Folktro,193.0,201.0,9.0,1906,urn:nbn:se:nordiskamuseet:diva-445
"Hammarstedt, Nils Edvard (Nordiska museet [877150])",Lussi,Luciafirande,1.0,38.0,38.0,1900,urn:nbn:se:nordiskamuseet:diva-291
"Alver, Brynjulf (Nordiska museet [877150])","Lussi, Tomas og Tollak: tre legendariske julefigurar.",Julseder;Luciafirande,105.0,126.0,22.0,1976,urn:nbn:se:nordiskamuseet:diva-1446
"Roos Björklund, Ingrid (Nordiska museet [877150])",Lyckan att klä av och på en docka,Pappersdockor,109.0,113.0,5.0,1991,urn:nbn:se:nordiskamuseet:diva-1654
"Jäfvert, Ernfrid (Nordiska museet [877150])",Lyskulan eller skomakarkulan : ett bidrag till belysningens historia,Belysning;Skomakeri,161.0,172.0,12.0,1954,urn:nbn:se:nordiskamuseet:diva-1106
"Bringeus, Nils-Arvid (Nordiska museet [877150])",Lysning,Äktenskap;Lysning,85.0,104.0,20.0,1969,urn:nbn:se:nordiskamuseet:diva-1395
"NN, nn (Nordiska museet [877150])","Läkaren, Barnets värld, Lin och linne - tre tillfälliga utställningar på Nordiska Museet 1945",Utställningsverksamhet,147.0,152.0,6.0,1944,urn:nbn:se:nordiskamuseet:diva-937
"Johannisson, Karin","Läkaren, hygienen och äcklet",Läkare;Hygien;Historia,48.0,61.0,14.0,2004,urn:nbn:se:nordiskamuseet:diva-1852
"Liedgren, Rut (Nordiska museet [877150])",Lärokursen för fruntimmer,Kvinnliga lärare;Utbildning;1800-talet;1900-talet;Sverige,97.0,116.0,20.0,1960,urn:nbn:se:nordiskamuseet:diva-1202
"Granlund, John (Nordiska museet [877150])",Lärt och folkligt i traditionen om väderleksmärken,Väderleksmärken,85.0,104.0,20.0,1976,urn:nbn:se:nordiskamuseet:diva-1445
"Okänd, Okänd (Nordiska museet [877150])",Läsning för syndaförlåtelse,Livets högtider och skeenden,21.0,21.0,1.0,1888,urn:nbn:se:nordiskamuseet:diva-192
"Ambrosiani, Sune (Nordiska museet [877150])",Lår från Mysslinge,Förvaringsmöbler;Kistor,15.0,36.0,22.0,1909,urn:nbn:se:nordiskamuseet:diva-590
"Baeckström, Arvid (Nordiska museet [877150])",Låt dina portar upp : glimtar av Skansen under fördelseåret,,109.0,128.0,20.0,1942,urn:nbn:se:nordiskamuseet:diva-896
"Keyland, Nils (Nordiska museet [877150])","Löftagning : Bilder och anteckningar från Jösse och Fryksdals härader,Värmland.",Fodermedel;Foderväxter;Utfodring;Får,101.0,109.0,9.0,1911,urn:nbn:se:nordiskamuseet:diva-642
"Silvén, Eva (Nordiska museet [877150])",Lövtäkt,Lövtäkt,101.0,115.0,15.0,1988,urn:nbn:se:nordiskamuseet:diva-1593
"Sjöbeck, Mårten (Nordiska museet [877150])",Löväng och trädgård : några förutsättningar för den svenska trädgårdens utveckling,Trädgårdar,59.0,74.0,16.0,1932,urn:nbn:se:nordiskamuseet:diva-280
"Szabó, Mátyás (Nordiska museet [877150])",Lövängen,Naturbruk;Ängar;Kulturmiljöer,78.0,99.0,22.0,1988,urn:nbn:se:nordiskamuseet:diva-1592
"Eldvik, Berit (Nordiska museet [877150])",Mah Jong. Mode och livsstil,Kläder;Mode;Mah Jong;Sverige;1960-talet;1970-talet,101.0,120.0,20.0,1988,urn:nbn:se:nordiskamuseet:diva-1607
"Rosengren, Annette (Nordiska museet [877150])",Maja Upmark,Amatörfotografer;Amatörfotografi;Fotografi;Maja Upmark,192.0,197.0,6.0,2009,urn:nbn:se:nordiskamuseet:diva-1975
"Andersson, Ann-Sofie",Makt och myndighet : om åldergränser och kvinnors rättigheter,Kvinnors rättigheter;1800-talet,82.0,93.0,12.0,2015,urn:nbn:se:nordiskamuseet:diva-2094
"Svenning, Olle","Malmö, Murdoch och Manchester united : om pengarna i fotbollen",Fotboll,260.0,273.0,14.0,2000,urn:nbn:se:nordiskamuseet:diva-1788
"Kjellström, Rolf (Nordiska museet [877150])",Mannen som steg av ballongen,Polarexpeditioner;1800-talet,203.0,220.0,18.0,1983,urn:nbn:se:nordiskamuseet:diva-1535
"Bæckström, Arvid (Nordiska museet [877150])",Maria Charotta Holtermans minnesalbum,Stamböcker (minnesböcker),159.0,178.0,20.0,1937,urn:nbn:se:nordiskamuseet:diva-462
"Wintzell, Inga (Nordiska museet [877150])",Maria och Jesper,Samtidsdokumentation;Ungdomar,232.0,245.0,14.0,1991,urn:nbn:se:nordiskamuseet:diva-1664
"Fries, Carl (Nordiska museet [877150])",Markens och djurens år på Skansen,Djurparker;Friluftsmuséer,93.0,110.0,18.0,1941,urn:nbn:se:nordiskamuseet:diva-871
"Grundström, Åke (Nordiska museet [877150]);Wallin, Sigurd (Nordiska museet [877150])",Markisens slott : en bildserie från Tyresö,Tyresö slott,72.0,94.0,23.0,1958,urn:nbn:se:nordiskamuseet:diva-1159
"Jansson, Sam Owen (Nordiska museet [877150])",Marshall Lagerquist : 1907-1977,Nordiska museets personal;Marshall Lagerquist,203.0,204.0,2.0,1977,urn:nbn:se:nordiskamuseet:diva-1466
"NN, nn (Nordiska museet [877150])",Massgrafven i Korsbetningen utanför Visby,Begravningsseder;Begravningsplatser,127.0,,,1906,urn:nbn:se:nordiskamuseet:diva-438
"Johannesson, Erik (Nordiska museet [877150])",Massorna i samhällets förstuga : om den liberala bildningsrörelsen vid 1800-talets mitt,Bildning;Sverige;1800-talet,71.0,90.0,20.0,1982,urn:nbn:se:nordiskamuseet:diva-1513
"Colling, Terje (Nordiska museet [877150])",Mat,Mat,17.0,19.0,3.0,1989,urn:nbn:se:nordiskamuseet:diva-1633
"Johnsson, Pehr (Nordiska museet [877150])",Mat och dryck : Hushållsbestyr i Göinge för en mansålder sedan.,Hushållsarbete,61.0,73.0,13.0,1916,urn:nbn:se:nordiskamuseet:diva-740
"Westergren, Christina (Nordiska museet [877150])",Mat och motstånd,Mat och dryck;Matvanor;Sverige,217.0,222.0,6.0,2001,urn:nbn:se:nordiskamuseet:diva-1818
"Holmquist, Kersti (Nordiska museet [877150])",Matbestick i rokoko,Bestick;1700-talet;Rokoko,141.0,154.0,14.0,1952,urn:nbn:se:nordiskamuseet:diva-1074
"Szabó, Mátyás (Nordiska museet [877150]);Brånvall, Birgit (Nordiska museet [877150]);Landin, Mats (Nordiska museet [877150])",Maten hos våra invandrare,Livsmedelsbutiker;Invandrare;Mat,155.0,165.0,11.0,1989,urn:nbn:se:nordiskamuseet:diva-1644
"Berg, Kerstin G:son (Nordiska museet [877150])",Mathållningen 1970 : Ett exempel på Nordiska museets aktuella frågelistverksamhet,Nordiska museets frågelistor;Mat,201.0,222.0,22.0,1972,urn:nbn:se:nordiskamuseet:diva-142
"Zachrisson, Sune (Nordiska museet [877150])",Mats Rehnberg : 1916-1984,Nordiska museets personal;Mats Rehnberg,178.0,180.0,3.0,1984,urn:nbn:se:nordiskamuseet:diva-1557
"Grundström, Åke (Nordiska museet [877150]);Rehnberg, Mats (Nordiska museet [877150])","Matsgården i Östbjörka, Rättvik",Byggnader;Dalarna;Byggnadsminnen;Kulturmiljöer,33.0,58.0,26.0,1955,urn:nbn:se:nordiskamuseet:diva-1114
"Hagberg, Louise (Nordiska museet [877150])",Matsmässa i Gagnef : På spaningsfärd efter en gammal folksed.,Bröllop,9.0,16.0,8.0,1913,urn:nbn:se:nordiskamuseet:diva-712
"Brundin, Elisabeth (Nordiska museet [877150])",Med crème fraiche i naturen : Samisk matlagning som säljer,Samisk matlagning,177.0,186.0,10.0,2001,urn:nbn:se:nordiskamuseet:diva-1813
"Nilsson, Albert (Nordiska museet [877150])",Med filmkamera i Solleröns älgmarker,Älgjakt;Etnografisk film,7.0,28.0,22.0,1939,urn:nbn:se:nordiskamuseet:diva-497
"Medelius, Hans (Nordiska museet [877150])",Med flygande fanor och klingande spel : skolungdomens vapenövningar,Elever;Vapenövningar;Historia;Sverige,125.0,144.0,20.0,1983,urn:nbn:se:nordiskamuseet:diva-1529
"Blomqvist, Annika (Nordiska museet [877150])",Med kokböckerna genom århundraden,Kokböcker;Matlagning;Historia;Sverige,11.0,18.0,8.0,2001,urn:nbn:se:nordiskamuseet:diva-1782
"Eriksson, Per",Med nya verktyg i en ny offentlighet,Folkkonst;Sverige,243.0,254.0,12.0,2005,urn:nbn:se:nordiskamuseet:diva-1903
"Knutsson, Johan (Nordiska museet [877150])",Med plats för två : - om brudstolarnas inbyggda mening,Brudstolar;Bröllop;Sverige,74.0,91.0,18.0,2012,urn:nbn:se:nordiskamuseet:diva-2015
"Persson, Yvonne (Nordiska museet [877150])",Med ryggarna mot omvärlden : värderingar och rollspel på Öckerö,Öckerö;Könsroller,141.0,150.0,10.0,1977,urn:nbn:se:nordiskamuseet:diva-1461
"Becker, Karin;Klein, Barbro",Med svenska ögon : - ett mångkulturellt odlingsområde 1990 och 2000,Koloniträdgårdar,151.0,181.0,31.0,2003,urn:nbn:se:nordiskamuseet:diva-1847
"Hansson, Per Albin (Nordiska museet [877150])",Medborgerlig anda och gärning : Tal på Skansen på Bondens Dag den 28 juli 1935,Politiker;Tal,7.0,14.0,8.0,1936,urn:nbn:se:nordiskamuseet:diva-401
"Branting, Agnes (Nordiska museet [877150])",Medeltida stola med knypplad ornering,Textilier;Knyppling,231.0,235.0,5.0,1907,urn:nbn:se:nordiskamuseet:diva-563
"Tornehed, Stig",Medeltiden i sydsvenska bonader,Bonader;Bonadsmåleri;Sverige,135.0,146.0,12.0,2005,urn:nbn:se:nordiskamuseet:diva-1874
"Elgqvist, Erik (Nordiska museet [877150])",Menträdet,Majstänger,148.0,152.0,5.0,1929,urn:nbn:se:nordiskamuseet:diva-519
"Roland, A (Nordiska museet [877150])",Mesula-konstruktioner,Husbyggnad,38.0,44.0,7.0,1906,urn:nbn:se:nordiskamuseet:diva-426
"Cronlund, Eskil (Nordiska museet [877150])",Midsommarfirande vid Österby Bruk,Midsommar,89.0,100.0,12.0,1937,urn:nbn:se:nordiskamuseet:diva-458
"Ambrosiani, Sune (Nordiska museet [877150])",Midsommarstakar eller majstänger,Majstänger;Midsommar,111.0,113.0,3.0,1913,urn:nbn:se:nordiskamuseet:diva-723
"Klein, Ernst (Nordiska museet [877150])",Midvinter och tjugondag,Tjugondag Knut;Julseder,44.0,66.0,23.0,1923,urn:nbn:se:nordiskamuseet:diva-697
"NN, nn (Nordiska museet [877150])",Mig för lof Ålt-Gesäll,Skråväsen,27.0,28.0,2.0,1889,urn:nbn:se:nordiskamuseet:diva-214
"Fürst, Carl Magnus (Nordiska museet [877150])",Mikroskop av svensk tillverkning,Mikroskop - historia,1.0,28.0,28.0,1923,urn:nbn:se:nordiskamuseet:diva-695
"Kiiski, Alma (Nordiska museet [877150])",Min första kyrkfärd,Karelen;Finland;Resor,41.0,50.0,10.0,1973,urn:nbn:se:nordiskamuseet:diva-179
"Liedgren, Rut (Nordiska museet [877150])",Min pappas leksaker,Leksaker;Lekar;Sverige;1800-talet,141.0,152.0,12.0,1967,urn:nbn:se:nordiskamuseet:diva-1359
"Mannerfelt, Måns (Nordiska museet [877150])",Min ungdoms landsväg : Minnen från Västergötland,Vägar;Minnen,49.0,60.0,12.0,1944,urn:nbn:se:nordiskamuseet:diva-929
"Kirkhorn, Olav (Nordiska museet [877150])",Minner fra en norsk vestlandsbygd,Arbete;Boende;Norge,107.0,120.0,14.0,1973,urn:nbn:se:nordiskamuseet:diva-185
"Hlödum, Olöf fra (Nordiska museet [877150])",Mitt barndomshem,Island;Boende;1800-talet,75.0,88.0,14.0,1973,urn:nbn:se:nordiskamuseet:diva-183
"Maxén, Maria (Nordiska museet [877150])",Mitt hem 1942,Hemmet;Sverige;1942;Samtidsdokumentation,18.0,51.0,34.0,1942,urn:nbn:se:nordiskamuseet:diva-2021
"Rosengren, Annette (Nordiska museet [877150])",Mjölk och kanelbullar : notiser från de hemlösas sfär,Hemlösa kvinnor;Mat;Måltider,113.0,118.0,6.0,2001,urn:nbn:se:nordiskamuseet:diva-1804
"Palmsköld, Anneli",Mode och återbruk,Återbruk;Mode;Återanvändning,232.0,251.0,20.0,2010,urn:nbn:se:nordiskamuseet:diva-1936
"Upmark, Märta (Nordiska museet [877150])",Modejournal en miniature,Modebilder;Museisamlingar;1600-talet,149.0,154.0,6.0,1965,urn:nbn:se:nordiskamuseet:diva-1330
"Wintzell, Inga (Nordiska museet [877150])",Modelejon och andra herrar,Herrmode;1800-talet;1900-talet,176.0,203.0,28.0,1988,urn:nbn:se:nordiskamuseet:diva-1611
"Eskeröd, Albert (Nordiska museet [877150])",Modell av ett plogspann från Skåne,Modeller;Lantbruksredskap,185.0,186.0,2.0,1965,urn:nbn:se:nordiskamuseet:diva-1334
"Wallin, Sigurd (Nordiska museet [877150])",Modellen till Strö herrgårdsbyggnad,Arkitekturmodeller,39.0,68.0,30.0,1938,urn:nbn:se:nordiskamuseet:diva-488
"Åkerlund, Johan (Nordiska museet [877150])",Modeller som kunskapsförmedlare,Lantbruksmaskiner;Modeller,183.0,192.0,10.0,1997,urn:nbn:se:nordiskamuseet:diva-1749
"Westergren, Christina (Nordiska museet [877150]);Eldvik, Berit (Nordiska museet [877150])",Modemedvetna museer,Nordiska museet;Museisamlingar;Föremålssamlingar,7.0,15.0,9.0,2010,urn:nbn:se:nordiskamuseet:diva-1922
"Berggren Torell, Viveka",Moderna barnkläder och moderiktiga barn,Barnkläder;Mode,166.0,193.0,28.0,2010,urn:nbn:se:nordiskamuseet:diva-1933
"Hagerman, Maja (Nordiska museet [877150])",Moderna tider : Skansen nyss och framöver,Skansen,296.0,315.0,20.0,2016,urn:nbn:se:nordiskamuseet:diva-2137
"Engman, Jonas (Nordiska museet [877150])",Modernitetens arenor : bilder av första maj på Skansen och Gärdet,Skansen;Första maj,50.0,59.0,10.0,2016,urn:nbn:se:nordiskamuseet:diva-2120
"Leijonhufvud, Sigrid (Nordiska museet [877150])",Modernt på 1760-talet : Kritiska glimtar ur Carl Gustaf Tessins dagbok.,Mode;1700-talet;Interiörer;Kläder;Sällskapsliv,27.0,42.0,16.0,1931,urn:nbn:se:nordiskamuseet:diva-245
"Roos Björklund, Ingrid (Nordiska museet [877150])",Modet i dockornas värld,Dockkläder;Mode,204.0,217.0,14.0,1988,urn:nbn:se:nordiskamuseet:diva-1612
"Rundquist, Angela (Nordiska museet [877150])",Modets makt,Mode;Kläder,13.0,31.0,19.0,1988,urn:nbn:se:nordiskamuseet:diva-1602
"Sjögren, Arthur (Nordiska museet [877150])",Monogrammisten något om äldre tiders klichétillverkning,Monogram;Klichéer (tryckblock),73.0,104.0,32.0,1914,urn:nbn:se:nordiskamuseet:diva-748
"Rundquist, Angela (Nordiska museet [877150])","Montebello, Fritz von Dardels sommarnöje vid Vaxholm",Fritz von Dardel;Sommarnöjen,151.0,172.0,22.0,1977,urn:nbn:se:nordiskamuseet:diva-1462
"Schoug, Fredrik",Moraliteter och mediala spektakel,idrott;Kommersialism;Etik,312.0,331.0,20.0,2000,urn:nbn:se:nordiskamuseet:diva-1791
"Lithberg, Nils (Nordiska museet [877150])",Mortlar och pepparkrossare hos svensk allmoge,Husgeråd,1.0,20.0,20.0,1918,urn:nbn:se:nordiskamuseet:diva-810
"Baksi, Nalin",Mot ett rättvist mångkulturellt samhälle,Mångkulturella samhällen;Sverige,15.0,27.0,13.0,1996,urn:nbn:se:nordiskamuseet:diva-1707
"Stridsberg, Laura (Nordiska museet [877150])",Museal mellantid : glimtar från tre decennier,Skansen;Nordiska museet,95.0,108.0,14.0,1958,urn:nbn:se:nordiskamuseet:diva-1160
