Name,Title,Keywords,StartPage,EndPage,Pages,Year,NBN
"Wiklund, K B (Nordiska museet [877150])",Om lapparnes tideräkning,Minoriteter;Samer;Tidmätning,3.0,27.0,25.0,1897,urn:nbn:se:nordiskamuseet:diva-235
"Lamm, Jan Peder",Om liar och liesmide,Liar;Smide,107.0,140.0,34.0,1977,urn:nbn:se:nordiskamuseet:diva-1460
"Jirlow, Ragnar (Nordiska museet [877150])",Om linberedning och linspinning hos svensk allmoge,Lin;Textilier - framställning;tillverkning etc. - historia,143.0,162.0,20.0,1924,urn:nbn:se:nordiskamuseet:diva-692
"Dalgård, W (Nordiska museet [877150])",Om linets odling och beredning,Lin;Linodling,14.0,20.0,7.0,1916,urn:nbn:se:nordiskamuseet:diva-734
"Bagge, Fredric (Nordiska museet [877150])",Om matsedlar,Matlagning;Mat och dryck;Livsmedel;Historia,67.0,84.0,18.0,1956,urn:nbn:se:nordiskamuseet:diva-1129
"Granlund, John (Nordiska museet [877150])",Om nyttan av att inrätta undersökningsstationer,Insamlingar;Kulturhistoria,247.0,256.0,10.0,1967,urn:nbn:se:nordiskamuseet:diva-1369
"Lindhagen, Arvid (Nordiska museet [877150])",Om några gamla regler för beräkning af de rörliga kyrkofesterna,Kyrkliga högtider;Kyrkoåret,129.0,139.0,11.0,1910,urn:nbn:se:nordiskamuseet:diva-625
"Berg, Gösta (Nordiska museet [877150])",Om ostron,Matlagning;Mat och dryck;Livsmedel;Historia;Ostron,15.0,28.0,14.0,1957,urn:nbn:se:nordiskamuseet:diva-1138
"Upmark, Gustaf (Nordiska museet [877150])",Om rokokomöbler och deras datering,Rokoko (möbelkonst),105.0,114.0,10.0,1910,urn:nbn:se:nordiskamuseet:diva-624
"Arwidsson, Ivar (Nordiska museet [877150])",Om sk laxjärn harpunartade redskap för fångst af lax,Fiskeredskap,104.0,109.0,6.0,1913,urn:nbn:se:nordiskamuseet:diva-721
"Björkquist, Lennart (Nordiska museet [877150])",Om slipstenshuggningen på södra Gotland : jämte några ord om den gotländska sandstensbrytningens historia.,Stenhuggeri;Stenindustri,145.0,155.0,11.0,1927,urn:nbn:se:nordiskamuseet:diva-395
"Hammarstedt, Nils Edvard (Nordiska museet [877150])",Om smöjning och därmed befryndade bruk : ett försök att genom jämförelse med motsvarigheter hos andra folk framvisa innebörden af en svensk fornsed,Folktro,34.0,45.0,12.0,1891,urn:nbn:se:nordiskamuseet:diva-205
"Arwidsson, Ivar (Nordiska museet [877150])",Om sättet att taga i snö nedkrupen orrfågel med håf.,Jakt;Fågeljakt,230.0,235.0,6.0,1910,urn:nbn:se:nordiskamuseet:diva-632
"Humbla, Philibert (Nordiska museet [877150])",Om tatuering i våra dagars Sverige,Tatueringar,95.0,115.0,21.0,1928,urn:nbn:se:nordiskamuseet:diva-475
"Axel-Nilsson, Göran (Nordiska museet [877150])",Om tennsoldater och tennfigurer,Leksaker;Tennsoldater,107.0,118.0,12.0,1971,urn:nbn:se:nordiskamuseet:diva-127
"Qvistgaard, A (Nordiska museet [877150])",Om tolfhålakringlor och andra julbröd,Bröd;Julseder,235.0,241.0,7.0,1908,urn:nbn:se:nordiskamuseet:diva-585
"Myrdal, Jan",Om vardagen och dess vin,Vin;Måltider,133.0,138.0,6.0,2001,urn:nbn:se:nordiskamuseet:diva-1807
"Weiser-Aall, Lily (Nordiska museet [877150])",Omkring lengden på dieperioden ifølge nyere norske opptegnelser,Amning,221.0,232.0,12.0,1976,urn:nbn:se:nordiskamuseet:diva-1453
"Palmstierna, Carl-Fredrik (Nordiska museet [877150])","""Opposition c'est conspiration"" : kring en kunglig snusdosa",Snusdosor;1800-talet;Museisamlingar,161.0,169.0,9.0,1961,urn:nbn:se:nordiskamuseet:diva-1229
"Hagberg, Louise (Nordiska museet [877150])",Ordets makt : Medicinska formler och besvärjelsertill invärtes bruk,Folkmedicin;Botare,75.0,88.0,14.0,1932,urn:nbn:se:nordiskamuseet:diva-281
"Sundberg, Ulrika",Ordning på alla saker,Nordiska museet;Museisamlingar;Föremålssamlingar;Skansen,138.0,139.0,2.0,2017,urn:nbn:se:nordiskamuseet:diva-2054
"Wallin, Leif (Nordiska museet [877150])",Ordning på dansen,Dans,149.0,166.0,18.0,2006,urn:nbn:se:nordiskamuseet:diva-1915
"Wistrand, Per Gustaf (Nordiska museet [877150])","Ordos Vicinalis : Byordning för Hargbo by, Vätö Socken, Uppland",Byar,104.0,108.0,5.0,1898,urn:nbn:se:nordiskamuseet:diva-265
"Wester, Bertil",Orglar och orgelpositiv i Nordiska museet,Orglar;Orgelpositiv,177.0,188.0,12.0,1953,urn:nbn:se:nordiskamuseet:diva-1091
"Sandström, Josef (Nordiska museet [877150])",Ornässtugan och dess inventarier 1725-1759,Möbler;Byggnader,213.0,220.0,8.0,1910,urn:nbn:se:nordiskamuseet:diva-629
"Ahnlund Berg, Charlotte",Oss andra : mångfald i  Artur Hazelius anda,Skansen;Museipedagogik,260.0,279.0,20.0,2016,urn:nbn:se:nordiskamuseet:diva-2134
"Lagercrantz, Bo (Nordiska museet [877150])",Ostindiskt,Ostindiskt porslin;Jean Abraham Grill;Nordiska museet,45.0,52.0,8.0,1993,urn:nbn:se:nordiskamuseet:diva-1676
"Boëthius, Gerda (Nordiska museet [877150])",Ottilia Adelborgs upptäcktsfärder med pennstift och dagbok,Teckning,131.0,146.0,16.0,1944,urn:nbn:se:nordiskamuseet:diva-936
"Wallin, Sigurd (Nordiska museet [877150])",Palbitzki i vapenlunden,Adelsvapen;Sverige,97.0,108.0,12.0,1962,urn:nbn:se:nordiskamuseet:diva-1242
"Persson, Helen (Nordiska museet [877150])",Pandoras skrin,Museisamlingar;Nordiska museet;Skrin;Siden;1600-talet,196.0,206.0,11.0,2002,urn:nbn:se:nordiskamuseet:diva-1834
"Lagerquist, Marshall (Nordiska museet [877150])",Paradsängen från Höja,Museisamlingar;Nordiska museet;Sängar;1700-talet,188.0,190.0,3.0,1959,urn:nbn:se:nordiskamuseet:diva-1190
"Selling, Gösta (Nordiska museet [877150])",Paradsängkammaren från Ulvsunda,Möbler;Sovrum;Heminredning;Nordiska museet,43.0,54.0,12.0,1950,urn:nbn:se:nordiskamuseet:diva-1031
"Johansson, Claes (Nordiska museet [877150])",Passionen för gammelbilar,Bilar;Sverige;Historia,168.0,185.0,18.0,1996,urn:nbn:se:nordiskamuseet:diva-1725
"Nathorst-Böös, Ernst (Nordiska museet [877150])",Pengar i plånboken : anteckningar rörande sedelavbildningar,Pengar i konsten;Sedelavbildningar,142.0,157.0,16.0,1959,urn:nbn:se:nordiskamuseet:diva-1183
"Berg, Gösta (Nordiska museet [877150])",Per Nordqvists porträtt av Böret Gregesdotter,Porträtt;1700-talet,189.0,194.0,6.0,1951,urn:nbn:se:nordiskamuseet:diva-1060
"Tornehave, Marie (Nordiska museet [877150])",Persienner,Persienner,316.0,319.0,4.0,2013,urn:nbn:se:nordiskamuseet:diva-2036
"Eriksson, Marianne (Nordiska museet [877150])",Personlig hygien,Personlig hygien,9.0,22.0,14.0,1970,urn:nbn:se:nordiskamuseet:diva-1406
"Knutsson, Johan (Nordiska museet [877150])",Personligt och bygdekarakteristiskt : form och dekor hos några skrin från Västergötand,Skrin;Kistor;Folkkonst;Västergötland,160.0,167.0,8.0,2005,urn:nbn:se:nordiskamuseet:diva-1877
"Hazelius-Berg, Gunnel (Nordiska museet [877150])",Peruker och hårtourer : Ur herrfrisyrens historia i Sverige,Peruker;Skråväsen;Frisyrer;Hårvård,103.0,126.0,24.0,1936,urn:nbn:se:nordiskamuseet:diva-406
"Richette, Christian (Nordiska museet [877150])",Petank : ett boulespel med anor,Boule,198.0,207.0,10.0,2014,urn:nbn:se:nordiskamuseet:diva-2082
"Rosengren, Annette (Nordiska museet [877150])",Peter Mesch,Amatörfotografer;Amatörfotografi;Fotografi;Peter Mesch,272.0,277.0,6.0,2009,urn:nbn:se:nordiskamuseet:diva-1988
"Wahlström, Axel Th. (Nordiska museet [877150])",Peter-Helenestugan i Skövde : Ett litet fornmuseum.,Fornminnesvård;Fornminnesföreningar,150.0,152.0,3.0,1925,urn:nbn:se:nordiskamuseet:diva-685
"Lassander-Karlsson, Lasse (Nordiska museet [877150])",Pettsongården,Museipedagogik;Julita gård,170.0,173.0,4.0,2014,urn:nbn:se:nordiskamuseet:diva-2080
"Carlheim-Gyllensköld, Monika (Nordiska museet [877150])",Picknick i det gröna,Picknick;Måltider,119.0,128.0,10.0,2001,urn:nbn:se:nordiskamuseet:diva-1805
"Ambrosiani, Sune (Nordiska museet [877150])",Pietas utställning av konserverade textilier,Textil konst;Textilkonservering,119.0,123.0,5.0,1911,urn:nbn:se:nordiskamuseet:diva-645
"Näsström, Karin (Nordiska museet [877150])",Pigbröllop hos Årstafrun,Pigor;Bröllop;Årstafrun;1800-talet;1700-talet,169.0,180.0,12.0,1969,urn:nbn:se:nordiskamuseet:diva-1405
"Sjöbeck, Mårten (Nordiska museet [877150])",Pilträd plantera åboerne flitigt : Några anteckningar om pilodlingen i sydsverige,Odling;Lövträd,47.0,66.0,20.0,1934,urn:nbn:se:nordiskamuseet:diva-352
"Waldetoft, Dan (Nordiska museet [877150])",Piskställningen,Städning;Piskställningar,104.0,107.0,4.0,2013,urn:nbn:se:nordiskamuseet:diva-2024
"Ambrosiani, Sune (Nordiska museet [877150])","Plankor med målning från Lunderhage, Gottland.",Husbyggnad,236.0,239.0,4.0,1910,urn:nbn:se:nordiskamuseet:diva-633
"Gustafsson, Berndt (Nordiska museet [877150])",Platsen för vigseln,Vigsel;Borgerlig vigsel,121.0,132.0,12.0,1969,urn:nbn:se:nordiskamuseet:diva-1397
"Ulrich, Arvid (Nordiska museet [877150])",Plåt- och harneskmakarämbetet i Säter,Harnesk;Rustningar;Plåttillverkning;Skråväsen,1.0,13.0,13.0,1916,urn:nbn:se:nordiskamuseet:diva-733
"Hammarstedt, Nils Edvard (Nordiska museet [877150])",PM för uppgifter angående julfirandet och där med sammanhängande folkseder,Julseder,58.0,59.0,2.0,1906,urn:nbn:se:nordiskamuseet:diva-430
"Bergengren, Göran (Nordiska museet [877150])",Polska pappersklipp,Silhuettklippning;Polen,191.0,193.0,3.0,1963,urn:nbn:se:nordiskamuseet:diva-1277
"Lagerquist, Marshall (Nordiska museet [877150])",Pontus de la Gardies ur,Ur (tidmätare),191.0,193.0,3.0,1942,urn:nbn:se:nordiskamuseet:diva-902
"Lagerquist, Marshall (Nordiska museet [877150]);Sjöqvist, Kerstin (Nordiska museet [877150])",Posthuset på Skansen,Skansen;Posthuset,153.0,174.0,22.0,1964,urn:nbn:se:nordiskamuseet:diva-1306
"Martinius, Birgitta (Nordiska museet [877150])",Prechtspeglar,Museisamlingar;Nordiska museet;Speglar,134.0,151.0,18.0,1997,urn:nbn:se:nordiskamuseet:diva-1745
"Holmquist, Kersti (Nordiska museet [877150])",Presenterbrickor,Serviser;1700-talet,198.0,202.0,5.0,1963,urn:nbn:se:nordiskamuseet:diva-1280
"Keyland, Nils (Nordiska museet [877150])",Primitiva eldgörningsmetoder i Sverige,Eld;Eldning,195.0,258.0,64.0,1916,urn:nbn:se:nordiskamuseet:diva-743
"Keyland, Nils (Nordiska museet [877150])",Primitiva eldgörningsmetoder i Sverige,Eld;Eldning,150.0,158.0,9.0,1918,urn:nbn:se:nordiskamuseet:diva-821
"Keyland, Nils (Nordiska museet [877150])",Primitiva eldgörningsmetoder i Sverige - forts,Eldning;Eld,86.0,98.0,13.0,1913,urn:nbn:se:nordiskamuseet:diva-719
"Keyland, Nils (Nordiska museet [877150])","Primitiva eldgörningsmetoder i Sverige. Gnideld, vrideld, slageld.",Eldning;Eld,193.0,236.0,44.0,1913,urn:nbn:se:nordiskamuseet:diva-730
"Keyland, Nils (Nordiska museet [877150])","Primitiva eldgörningsmetoder i Sverige. Gnideld, vrideld, slageld. : Med en jämförande studie af Nils Keyland",Eld;Eldning,1.0,20.0,20.0,1912,urn:nbn:se:nordiskamuseet:diva-656
"Cederblom, Gerda (Nordiska museet [877150]);Upmark, Gustaf (Nordiska museet [877150])",Professorskan Therese Kjellbergs silfversamling,Silver;Föremålssamlingar;Samlarverksamhet,237.0,255.0,19.0,1913,urn:nbn:se:nordiskamuseet:diva-731
"Lindblom, Andreas (Nordiska museet [877150])",Profeternas underverk i Spånga,Kyrkomåleri;Bilder - religiösa aspekter;Spånga kyrka,111.0,136.0,26.0,1956,urn:nbn:se:nordiskamuseet:diva-1132
"Erixon, Sigurd (Nordiska museet [877150])",Prästgårdar  i Dalarna under 1600-talets senare del.,Prästgårdar,35.0,84.0,50.0,1924,urn:nbn:se:nordiskamuseet:diva-688
"Erixon, Sigurd (Nordiska museet [877150])",Prästgårdar i Dalarna under 1600-talets senare del,Prästgårdar,163.0,183.0,21.0,1924,urn:nbn:se:nordiskamuseet:diva-693
"Rudberg, Gunnar (Nordiska museet [877150])",Psalm - visa,Visor;Psalmer;Andliga sånger och visor,230.0,235.0,6.0,1908,urn:nbn:se:nordiskamuseet:diva-584
"Hellspong, Mats (Nordiska museet [877150])",Publiken,Idrottspublik,76.0,95.0,20.0,2000,urn:nbn:se:nordiskamuseet:diva-1841
"Tegnér, Annika (Nordiska museet [877150])","Puddingar, pastejer och terriner",Matlagning;Husgeråd,167.0,176.0,10.0,2001,urn:nbn:se:nordiskamuseet:diva-1812
"Jäfvert, Ernfrid (Nordiska museet [877150])",Pumpsydd brudsko från malung,Skor;Bröllopskläder,208.0,210.0,3.0,1942,urn:nbn:se:nordiskamuseet:diva-906
"Biörnstad, Arne (Nordiska museet [877150])","""Pundstol"" för pepparrot",Museisamlingar;Nordiska museet,213.0,214.0,2.0,1958,urn:nbn:se:nordiskamuseet:diva-1174
"Rosengren, Annette (Nordiska museet [877150])",På cykel i Bergslagen,Amatörfotografer;Amatörfotografi;Fotografi,188.0,191.0,4.0,2009,urn:nbn:se:nordiskamuseet:diva-1973
"Myrdal, Janken (Nordiska museet [877150])",På höga hästar : hästen som maktmedel och statussymbol,Hästar,99.0,110.0,12.0,1986,urn:nbn:se:nordiskamuseet:diva-1577
"Wallin, Sigurd (Nordiska museet [877150])",På kungens platå : under Carl XIV Johans kronprinstid,Bordsdekorationer,129.0,152.0,24.0,1951,urn:nbn:se:nordiskamuseet:diva-1056
"Danielson, Sofia (Nordiska museet [877150])",På skattjakt i samlingarna : museiföremål som kunskapskälla,Museisamlingar;Nordiska museet,54.0,65.0,12.0,1997,urn:nbn:se:nordiskamuseet:diva-1738
"Slåtteröy, Johan (Nordiska museet [877150])",På skreifiske og markedsferd i Nord-Norge,Fiske;Norge,89.0,106.0,18.0,1973,urn:nbn:se:nordiskamuseet:diva-184
"Rosander, Göran (Nordiska museet [877150])",På väg : färdandets folk under tusen år,Resenärer,9.0,40.0,32.0,1978,urn:nbn:se:nordiskamuseet:diva-1473
"Hagberg, Louise (Nordiska museet [877150])",Påskäggen och deras hedniska ursprung,Påsken;Påskägg,129.0,154.0,26.0,1906,urn:nbn:se:nordiskamuseet:diva-439
"Rosengren, Annette (Nordiska museet [877150])",Raggare och jänkebilar,Raggare;Bilar;Sverige,148.0,167.0,20.0,1996,urn:nbn:se:nordiskamuseet:diva-1724
"Wallin, Sigurd (Nordiska museet [877150])",Rak rokoko,Rokoko (möbelkonst);Möbelstilar,89.0,112.0,24.0,1964,urn:nbn:se:nordiskamuseet:diva-1301
"Wallquist, Cecilia (Nordiska museet [877150])",Rakhyveln,Rakhyvlar,222.0,223.0,2.0,2015,urn:nbn:se:nordiskamuseet:diva-2105
"Tunberg, Anders (Nordiska museet [877150])",Rally - en svensk folksport,Rally;Sverige,186.0,205.0,20.0,1996,urn:nbn:se:nordiskamuseet:diva-1726
"Stavenow-Hidemark, Elisabet (Nordiska museet [877150])",Randigt och rutigt : hemslöjdskonst under drygt 30 år,Hemslöjd;Textilier;Museisamlingar;Nordiska museet,199.0,202.0,4.0,1959,urn:nbn:se:nordiskamuseet:diva-1196
"Bengtsson, Bengt (Nordiska museet [877150])",Rationalisering hos hantverkare på 1700-talet,Hantverkare;1700-talet,111.0,124.0,14.0,1952,urn:nbn:se:nordiskamuseet:diva-1072
"Berlin, Ulla (Nordiska museet [877150])",Ravlundagården och dess gamla miljö,Byggnader;Ravlunda socken,35.0,60.0,26.0,1949,urn:nbn:se:nordiskamuseet:diva-1016
"Szabó, Mátyás (Nordiska museet [877150])",Rena djur,Djurhållning;Lantbruk;Hygien;Sverige;Historia,155.0,168.0,14.0,1970,urn:nbn:se:nordiskamuseet:diva-1417
"Kjellström, Rolf (Nordiska museet [877150])",Renen som husdjur,Renar;Rennäring;Historia,163.0,170.0,8.0,1986,urn:nbn:se:nordiskamuseet:diva-1584
"Cederblom, Gerda (Nordiska museet [877150])",Renhornsornament å Helsinglands kjolväskor,Ornamentik,109.0,114.0,6.0,1923,urn:nbn:se:nordiskamuseet:diva-702
"Lindström, Ulla (Nordiska museet [877150])",Renlighetsuppfostran,Toaletträning;Personlig hygien,23.0,32.0,10.0,1970,urn:nbn:se:nordiskamuseet:diva-1407
"Svensson, Sigfrid (Nordiska museet [877150])",Rensning av källa - regnmagi,Folktro,68.0,68.0,1.0,1927,urn:nbn:se:nordiskamuseet:diva-389
"Andolf, Göran",Resandets revolutioner,Resenärer,49.0,72.0,24.0,1978,urn:nbn:se:nordiskamuseet:diva-1475
"Althin, Torsten (Nordiska museet [877150])",Restaureringen av mekaniska modeller,,1.0,11.0,11.0,1928,urn:nbn:se:nordiskamuseet:diva-468
"Jensen, Christian Axel (Nordiska museet [877150])",Rigshofmesteren Christoffer Walckendorffs portraet : Et dansk alabastrelief fra renaissanoetiden,Reliefer;Skulptur;Alabasterarbeten,12.0,17.0,6.0,1927,urn:nbn:se:nordiskamuseet:diva-383
"Weintraub, Nora",Riktigt rent,Personlig hygien;Badvanor,150.0,165.0,16.0,2004,urn:nbn:se:nordiskamuseet:diva-1859
"Lithberg, Nils (Nordiska museet [877150])",Rimstavar med rättade gyllental före år 1600,Runstavar,1.0,26.0,26.0,1920,urn:nbn:se:nordiskamuseet:diva-760
"Kotsinas, Ulla-Britt",Rinkebysvenska - ett ungdomsspråk,Ungdomskultur;Rinkeby,28.0,45.0,18.0,1996,urn:nbn:se:nordiskamuseet:diva-1709
"Gyllensvärd, Bo",Rinkesta-tapeten : ett svenskt barockkineseri från 1733,Tapeter;1700-talet,101.0,114.0,14.0,1948,urn:nbn:se:nordiskamuseet:diva-1004
"Honko, Lauri (Nordiska museet [877150])",Riter: en klassifikation,Riter,71.0,84.0,14.0,1976,urn:nbn:se:nordiskamuseet:diva-1444
"Sjöberg, Nils (Nordiska museet [877150])",Rituala bruk vid våra hälsokällor,Källor;Hälsobrunnar,46.0,51.0,6.0,1911,urn:nbn:se:nordiskamuseet:diva-640
"Bergstrand, C M (Nordiska museet [877150])",Rituell eldgnidning vid 1900-talets början,Eld,65.0,67.0,3.0,1927,urn:nbn:se:nordiskamuseet:diva-388
"Olsson, Marianne (Nordiska museet [877150])",Rokoko eller funkis,Heminredning;Sverige;1920-talet,51.0,70.0,20.0,1968,urn:nbn:se:nordiskamuseet:diva-1374
"Jobs Arnberg, Anna-Karin (Nordiska museet [877150])",Rosen - en broderad kärlekshistoria,Broderi;Rosor;Kärlek,158.0,173.0,16.0,2012,urn:nbn:se:nordiskamuseet:diva-2016
"Svärdström, Svante (Nordiska museet [877150])",Rosmålning och kurbits : en studie i det yngre dalmåleriet,Kurbitsmålning;Dalmålningar,121.0,146.0,26.0,1934,urn:nbn:se:nordiskamuseet:diva-356
"Lindblom, Andreas (Nordiska museet [877150])",Rudolf Cederström,Rudolf Cederström,165.0,166.0,2.0,1945,urn:nbn:se:nordiskamuseet:diva-960
"Rosengren, Annette (Nordiska museet [877150])",Rune Jonsson,Amatörfotografer;Amatörfotografi;Fotografi;Rune Jonsson,244.0,247.0,4.0,2009,urn:nbn:se:nordiskamuseet:diva-1984
"Erixon, Sigurd (Nordiska museet [877150])",Runinskrifter från Dalarna,Runor;Runinskrifter,147.0,162.0,16.0,1915,urn:nbn:se:nordiskamuseet:diva-785
"Lithberg, Nils (Nordiska museet [877150])","Runstaven, en ursvensk rådgivare åt Sveriges bönder",Runstavar;Jordbruk,117.0,138.0,22.0,1932,urn:nbn:se:nordiskamuseet:diva-284
"Lithberg, Nils (Nordiska museet [877150])",Runstavens uppkomst,Runstavar;Tideräkning,1.0,27.0,27.0,1921,urn:nbn:se:nordiskamuseet:diva-865
"Wistrand, Per Gustaf (Nordiska museet [877150])",Runsticka från Dalarna,Runstavar;Alfabet - historia,40.0,41.0,2.0,1907,urn:nbn:se:nordiskamuseet:diva-546
"Ronström, Ove",Russindisko och seniordans,Sällskapsdans;Pensionärer;Sverige,220.0,237.0,18.0,2006,urn:nbn:se:nordiskamuseet:diva-1920
"Palmér, Emma","Rustan Bergwall : - brukstjänsteman, guldgrävare och jägare i Sibirien",Amatörfotografer;Amatörfotografi;Fotografi;Rustan Bergwall,158.0,165.0,8.0,2009,urn:nbn:se:nordiskamuseet:diva-1967
"Rosengren, Annette (Nordiska museet [877150])",Rut Nilsson,Amatörfotografer;Amatörfotografi;Fotografi;Rut Nilsson,218.0,221.0,4.0,2009,urn:nbn:se:nordiskamuseet:diva-1979
"Fürst, Carl Magnus (Nordiska museet [877150])",Ryggåsastugor i Bleking,Bebyggelse;Boende,94.0,102.0,9.0,1886,urn:nbn:se:nordiskamuseet:diva-208
"Jansson, Sam Owen (Nordiska museet [877150])",Rätt våg och rätt skäppa : Ur Besmanets och spannmålsmåttens svenska historia,Spannmålsmått,147.0,168.0,22.0,1936,urn:nbn:se:nordiskamuseet:diva-408
"Wallquist, Cecilia (Nordiska museet [877150])","Rätten att få vara gammal : samtal om acceptans, villkor och fördomar",Åldrandet,284.0,301.0,18.0,2015,urn:nbn:se:nordiskamuseet:diva-2116
"Ambrosiani, Sune (Nordiska museet [877150])",Rörstrandskakel från år 1727,Kakel,53.0,57.0,5.0,1913,urn:nbn:se:nordiskamuseet:diva-715
"NN, nn (Nordiska museet [877150])",Röster från hela Sverige,,25.0,74.0,50.0,1941,urn:nbn:se:nordiskamuseet:diva-869
"Gullberg, Hjalmar (Nordiska museet [877150])",Röster från Skansen,,7.0,24.0,18.0,1941,urn:nbn:se:nordiskamuseet:diva-872
"Eldvik, Berit (Nordiska museet [877150])",Rött på vitt : broderier från Järvsö,Broderier;Järvsö,57.0,74.0,18.0,1977,urn:nbn:se:nordiskamuseet:diva-1457
"Samzelius, Hugo (Nordiska museet [877150])","Sagor och sägner, skrock och öfvertro från finnbygder och lappmarker",Folktro;Finnmarker;Samer,184.0,212.0,29.0,1904,urn:nbn:se:nordiskamuseet:diva-415
"Samzelius, Hugo (Nordiska museet [877150])","Sagor och sägner, skrock och öfvertro från finnbygder och lappmarker",Sägner;Sagor,191.0,234.0,44.0,1905,urn:nbn:se:nordiskamuseet:diva-420
"Liedgren, Rut (Nordiska museet [877150])",Sailor's gifts,Möbler;Heminredning,25.0,42.0,18.0,1950,urn:nbn:se:nordiskamuseet:diva-1030
"Andrén, Erik (Nordiska museet [877150])",Salsta slotts arkitekt,Salsta slott;Nicodemus Tessin d. ä.,57.0,66.0,10.0,1952,urn:nbn:se:nordiskamuseet:diva-1069
"Appelgren, Stig (Nordiska museet [877150])",Sam Owen Jansson : 1906-1985,Nordiska museets personal;Sam Owen Jansson,175.0,177.0,3.0,1985,urn:nbn:se:nordiskamuseet:diva-1570
"Nylund, Anna-Vera","Sameliv på Skansen : om natur och kultur, upplevelser och lärande",Samer;Skansen,138.0,157.0,20.0,2008,urn:nbn:se:nordiskamuseet:diva-1946
"Jonsson, Johan",Samer i bild - bilder av samer : ett fotografi och tre berättelser,Samer.Fotogtafier,107.0,120.0,14.0,2008,urn:nbn:se:nordiskamuseet:diva-1944
"Jönses, Lars (Nordiska museet [877150])",Samerna i den kulturella konstruktionen av territoriet,Samer;Historia,43.0,57.0,15.0,2008,urn:nbn:se:nordiskamuseet:diva-1940
"Svonni, Mikael",Samerna i språkhistorien,Samer;Samiska språk,32.0,42.0,11.0,2008,urn:nbn:se:nordiskamuseet:diva-1939
"Kjellström, Rolf (Nordiska museet [877150])",Samernas traditionella lekar och spel,Samer;Lekar;Spel,152.0,165.0,14.0,1991,urn:nbn:se:nordiskamuseet:diva-1659
"Melin, Boel",Samevistet,Skansen;Samer,120.0,121.0,2.0,2016,urn:nbn:se:nordiskamuseet:diva-2125
"Arnstberg, Karl-Olov (Nordiska museet [877150])",Samhälle och sårbarhet : reflektioner från ett kulturanalytiskt perspektiv,Samhället,11.0,38.0,28.0,1985,urn:nbn:se:nordiskamuseet:diva-1559
"Palme, Sven Ulric (Nordiska museet [877150])",Samhället och barnen på änglamakerskornas tid,Barndomen;Barnamord,47.0,62.0,16.0,1971,urn:nbn:se:nordiskamuseet:diva-123
"Klein, Ernst (Nordiska museet [877150])",Samhällssyn på Engelbrektstiden : en skrivares bildkommentarer till landslagen,lag och moral,73.0,86.0,14.0,1935,urn:nbn:se:nordiskamuseet:diva-372
"Silvén, Eva (Nordiska museet [877150])",Samiska scener och scenerier,Samer,121.0,137.0,17.0,2008,urn:nbn:se:nordiskamuseet:diva-1945
"Hamilton, Ulf (Nordiska museet [877150])",Samlare och kalenderbitare,Samlarbilder;Idrott,216.0,235.0,20.0,2000,urn:nbn:se:nordiskamuseet:diva-1786
"Fouganthine, Anna",Samlarna samlas,Samlarverksamhet,235.0,245.0,11.0,2007,urn:nbn:se:nordiskamuseet:diva-1893
"Hillström, Magdalena",Samlingar i oändlighet!,Nordiska museet,66.0,78.0,13.0,2007,urn:nbn:se:nordiskamuseet:diva-1882
"Ekström, Karin M.",Samlingars värden : om ting och människor i konsumtionssamhället,Samlarverksamhet,221.0,234.0,14.0,2007,urn:nbn:se:nordiskamuseet:diva-1892
"Nyman, Thure (Nordiska museet [877150])",Samuel Hoffmeister,Porträttkonst,6.0,15.0,10.0,1930,urn:nbn:se:nordiskamuseet:diva-329
"Blees, Jakob (Nordiska museet [877150])",Sankt Martinsdagens firande : i Nuckö-Rickholz i Estland.,Högtider,116.0,121.0,6.0,1898,urn:nbn:se:nordiskamuseet:diva-267
"Eldvik, Berit (Nordiska museet [877150])",Schalen - ett modeplagg,Sjalar,114.0,127.0,14.0,2010,urn:nbn:se:nordiskamuseet:diva-1930
"Landin, Mats (Nordiska museet [877150])",Se gröten,Gröt,163.0,166.0,4.0,2001,urn:nbn:se:nordiskamuseet:diva-1811
"Kristensson, Karolina (Nordiska museet [877150]);Fredriksson, Emma (Nordiska museet [877150])",Se ut : en fotoessä,Fotografi;Samtidsdokumentation,180.0,195.0,16.0,2015,urn:nbn:se:nordiskamuseet:diva-2101
"Carlsson, Anders (Nordiska museet [877150])",Se åldern : en inledning,Åldrandet,7.0,10.0,4.0,2015,urn:nbn:se:nordiskamuseet:diva-2085
"Reimer, Ludvig (Nordiska museet [877150])",Seder och bruk i Albo härad i början av 1800-talet,Kläder;Bostäder;Vardagsliv,208.0,219.0,12.0,1908,urn:nbn:se:nordiskamuseet:diva-582
"Lundquist, Aurore (Nordiska museet [877150])",Seder och bruk i Julita socken i Södermanland : anteckningar gjorda år 1890,Julitta,27.0,34.0,8.0,1891,urn:nbn:se:nordiskamuseet:diva-225
"Keyland, Nils (Nordiska museet [877150])",Seder och bruk vid dödsfall och begravning i Västra Värmland,Begravning;Begravningsseder,94.0,108.0,15.0,1923,urn:nbn:se:nordiskamuseet:diva-701
"Hammarstedt, Nils Edvard (Nordiska museet [877150])","Seder vid åkerbruk och boskapsskötsel, som härleda sig från jakt och fångstriter",Jakt;Fiske;Boskapsskötsel;Jordbruk,40.0,50.0,11.0,1927,urn:nbn:se:nordiskamuseet:diva-385
"Wallin, Sigurd (Nordiska museet [877150])",Sengustavianska möbler från sydsverige eller Danmark,Möbler;Gustaviansk stil,140.0,149.0,10.0,1925,urn:nbn:se:nordiskamuseet:diva-684
"Keyland, Nils (Nordiska museet [877150])","Sentrådsspinning, tenndragning och bältsmyckegjutning hos lapparna i Norra Jämtland",Tennarbeten,145.0,177.0,33.0,1920,urn:nbn:se:nordiskamuseet:diva-767
"Liedgren, Rut (Nordiska museet [877150])",Severin Nilson som fotograf,Fotografer;Severin Nilson,7.0,24.0,18.0,1958,urn:nbn:se:nordiskamuseet:diva-1156
"Rosengren, Annette (Nordiska museet [877150])",Signe Svärd,Amatörfotografer;Amatörfotografi;Fotografi;Fotoalbum;Signe Svärd,212.0,217.0,6.0,2009,urn:nbn:se:nordiskamuseet:diva-1978
"Wistrand, Per Gustaf (Nordiska museet [877150])",Signelse eller läsning mot svartsjuka,Folktro,31.0,,,1890,urn:nbn:se:nordiskamuseet:diva-221
"Wistrand, Per Gustaf (Nordiska museet [877150])",Signelser från Småland : antecknade under några på Nordiska museets bekostnad företagna resor 1879 och 1880,Folktro;Småland,15.0,50.0,36.0,1898,urn:nbn:se:nordiskamuseet:diva-262
"Svensson, Sigfrid (Nordiska museet [877150])","Sigurd Erixon och Sigurd Wallin : forskare, museimän, personligheter",Sigurd Erixon;Sigurd Wallin,231.0,238.0,8.0,1969,urn:nbn:se:nordiskamuseet:diva-1404
"Granlund, John (Nordiska museet [877150])",Sikfesten i Kukkola : en fiskfest med forntida anor,Fiske;Fester,59.0,76.0,18.0,1940,urn:nbn:se:nordiskamuseet:diva-532
